folder,press_release_text,dd_folder,dd_date,dd_h1,dd_article,dd_end,dd_error
clearpath-lending-inc,"cf b Consumer Financial
Protection Bureau

 

Consumer Financial Protection Bureau Settles with Eighth Mortgage Company to
Address Deceptive Loan Advertisements Sent to Servicemembers and Veterans

SEP 14, 2020

WASHINGTON, D.C. - Today, the Consumer Financial Protection Bureau (Bureau) issued a
consent order against ClearPath Lending, Inc. (ClearPath), a California corporation that is
licensed as a mortgage broker or lender in about 22 states. ClearPath offers and provides
mortgage loans guaranteed by the United States Department of Veterans Affairs (VA).
ClearPath’s principal means of advertising VA-guaranteed loans is through direct-mail
advertisements sent primarily to United States military servicemembers and veterans. The
Bureau found that ClearPath sent consumers mailers for VA-guaranteed mortgages that
contained false, misleading, and inaccurate statements or that lacked required disclosures,
in violation of the Consumer Financial Protection Act’s (CFPA) prohibition against deceptive
acts and practices, the Mortgage Acts and Practices—Advertising Rule (MAP Rule), and
Regulation Z. The consent order requires ClearPath to pay a civil money penalty and
imposes requirements to prevent future violations.

Today's action is the eighth case stemming from a Bureau sweep of investigations of
multiple mortgage companies that use deceptive mailers to advertise VA-guaranteed
mortgages. The Bureau commenced this sweep in response to concerns about potentially
unlawful advertising in the market that the VA identified. This ongoing sweep of
investigations reflects the Bureau’s commitment to enforcing the laws that ensure the
financial marketplace is fair and accurate for all consumers, including servicemembers,
veterans, and surviving spouses whom VA-guaranteed mortgages are designed to benefit.

The Bureau found that ClearPath disseminated advertisements that contained false,
misleading, and inaccurate statements or that failed to include required disclosures. For
example, ClearPath advertisements misrepresented the credit terms of the advertised
mortgage loan by stating credit terms that the company was not actually prepared to offer
to the consumer, including misrepresenting the annual percentage rate applicable to the
advertised mortgage. ClearPath also misleadingly advertised rates or payments as fixed,
even though the advertised mortgage was an adjustable-rate mortgage or the payment was
not fixed for the indicated duration. ClearPath also misrepresented the existence, nature, or
amount of cash or credit available to the consumer, and the existence or amount of fees or
costs to the consumer, in connection with the advertised mortgage. The Bureau also found
that ClearPath advertisements created the false impression that ClearPath was affiliated with
the VA. ClearPath advertisements also failed to properly disclose, when required by
Regulation Z, credit terms for the advertised mortgage, such as the number and time period
of payments associated with the consumer's repayment obligations over the full term of the
loan. Finally, the Bureau found that ClearPath advertisements used the name of the
consumer's lender in a misleading way by not adequately disclosing ClearPath’s name and
the fact that it was not associated with, or acting on behalf of, the consumer's current lender,
as required by Regulation Z.

The consent order against ClearPath requires ClearPath to pay a civil penalty of $625,000.
The consent order also imposes injunctive relief to prevent future violations, including
requiring ClearPath to bolster its compliance functions by designating an advertising
compliance official who must review its mortgage advertisements for compliance with
mortgage advertising laws prior to their use; prohibiting misrepresentations similar to those
identified by the Bureau; and requiring ClearPath to comply with certain enhanced
disclosure requirements to prevent future misrepresentations.

The consent order against ClearPath can be found at:
https://files.consumerfinance.gov/f/documents/cfpb_clearpath-lending-inc_consent-

 

r_2020-09.pdf)

tHE
The Consumer Financial Protection Bureau (CFPB) is a 21st century agency that helps
consumer finance markets work by making rules more effective, by consistently and fairly
enforcing those rules, and by empowering consumers to take more control over their
economic lives. For more information, visit www.consumerfinance.gov.

 

 

PRESS INFORMATION

If you want to republish the article or have questions about the content, please contact the
press office.

Go to press resources page (cfpb.gov/about-us/newsroom/press-resources/)

 

li

An official website of the
United States government
",--ERROR--,"sep 14, 2020",consumer financial protection bureau settles with eighth mortgage company to address deceptive loan advertisements sent to servicemembers and veterans.,"washington, d.c. - today, the consumer financial protection bureau (bureau) issued a consent order against clearpath lending, inc. (clearpath), a california corporation that is licensed as a mortgage broker or lender in about 22 states. clearpath offers and provides mortgage loans guaranteed by the united states department of veterans affairs (va).
 clearpath's principal means of advertising va-guaranteed loans is through direct-mail advertisements sent primarily to united states military servicemembers and veterans. the bureau found that clearpath sent consumers mailers for va-guaranteed mortgages that contained false, misleading, and inaccurate statements or that lacked required disclosures, in violation of the consumer financial protection act's (cfpa) prohibition against deceptive acts and practices, the mortgage acts and practicesadvertising rule (map rule), and regulation z. the consent order requires clearpath to pay a civil money penalty and imposes requirements to prevent future violations.
 today's action is the eighth case stemming from a bureau sweep of investigations of multiple mortgage companies that use deceptive mailers to advertise va-guaranteed mortgages. the bureau commenced this sweep in response to concerns about potentially unlawful advertising in the market that the va identified. this ongoing sweep of investigations reflects the bureau's commitment to enforcing the laws that ensure the financial marketplace is fair and accurate for all consumers, including servicemembers, veterans, and surviving spouses whom va-guaranteed mortgages are designed to benefit.
 the bureau found that clearpath disseminated advertisements that contained false, misleading, and inaccurate statements or that failed to include required disclosures. for example, clearpath advertisements misrepresented the credit terms of the advertised mortgage loan by stating credit terms that the company was not actually prepared to offer to the consumer, including misrepresenting the annual percentage rate applicable to the advertised mortgage. clearpath also misleadingly advertised rates or payments as fixed, even though the advertised mortgage was an adjustable-rate mortgage or the payment was not fixed for the indicated duration. clearpath also misrepresented the existence, nature, or amount of cash or credit available to the consumer, and the existence or amount of fees or costs to the consumer, in connection with the advertised mortgage. the bureau also found that clearpath advertisements created the false impression that clearpath was affiliated with the va. clearpath advertisements also failed to properly disclose, when required by regulation z, credit terms for the advertised mortgage, such as the number and time period of payments associated with the consumer's repayment obligations over the full term of the loan. finally, the bureau found that clearpath advertisements used the name of the consumer's lender in a misleading way by not adequately disclosing clearpath's name and the fact that it was not associated with, or acting on behalf of, the consumer's current lender, as required by regulation z.
 the consent order against clearpath requires clearpath to pay a civil penalty of $625,000.
 the consent order also imposes injunctive relief to prevent future violations, including requiring clearpath to bolster its compliance functions by designating an advertising compliance official who must review its mortgage advertisements for compliance with mortgage advertising laws prior to their use; prohibiting misrepresentations similar to those identified by the bureau; and requiring clearpath to comply with certain enhanced disclosure requirements to prevent future misrepresentations.
 the consent order against clearpath can be found at: https://files.consumerfinance.gov/f/documents/cfpb_clearpath-lending-inc_consent- r_2020-09.pdf) the the consumer financial protection bureau (cfpb) is a 21st century agency that helps consumer finance markets work by making rules more effective, by consistently and fairly enforcing those rules, and by empowering consumers to take more control over their economic lives. for more information, visit www.consumerfinance.gov.
 press information if you want to republish the article or have questions about the content, please contact the press office.
 go to press resources page (cfpb.gov/about-us/newsroom/press-resources/) li an official website of the united states government",--ERROR--,0
phloans,"cf b Consumer Financial
Protection Bureau

 

Consumer Financial Protection Bureau Settles with Fourth Mortgage Company to
Address Deceptive Loan Advertisements Sent to Servicemembers and Veterans

AUG 26, 2020

WASHINGTON, D.C. - Today, the Consumer Financial Protection Bureau (Bureau) issued a
consent order against PHLoans.com, Inc. (PHLoans), a California corporation that is licensed
as a mortgage broker or lender in about 11 states. Until at least April 2019, PHLoans was
known as Pacific Home Loans, Inc. PHLoans offers and provides mortgage loans guaranteed
by the United States Department of Veterans Affairs (VA). PHLoans’s principal means of
advertising VA-guaranteed loans is through direct-mail advertisements sent primarily to
United States military servicemembers and veterans. The Bureau found that PHLoans sent
consumers numerous mailers for VA-guaranteed mortgages that contained false,
misleading, and inaccurate statements or that lacked required disclosures, in violation of the
Consumer Financial Protection Act's (CFPA) prohibition against deceptive acts and
practices, the Mortgage Acts and Practices—Advertising Rule (MAP Rule), and Regulation Z.
The consent order requires PHLoans to pay a civil money penalty and imposes
requirements to prevent future violations.

Today’s action is the fourth case stemming from a Bureau sweep of investigations of
multiple mortgage companies that use deceptive mailers to advertise VA-guaranteed
mortgages. On July 24, 2020, the Bureau announced consent orders against Sovereign
Lending Group, Inc., and Prime Choice Funding, Inc., and on August 21, 2020, the Bureau
announced a consent order against Go Direct Lenders, Inc., for similar violations. The
Bureau commenced this sweep in response to concerns about potentially unlawful
advertising in the market that the VA identified. Accurate and legally compliant advertising
provides consumers with valuable information about the different types of mortgages and
terms available so they can effectively shop for products that best meet their needs. This
ongoing sweep of investigations reflects the Bureau’s commitment to enforcing the laws
that ensure the financial marketplace is fair and accurate for all consumers, including
servicemembers, veterans, and surviving spouses whom VA-guaranteed mortgages are
designed to benefit.

The Bureau found that PHLoans disseminated advertisements that contained false,
misleading, and inaccurate statements or that failed to include required disclosures. For
example, PHLoans advertisements misrepresented the credit terms of the advertised
mortgage loan by stating credit terms that the company was not actually prepared to offer
to the consumer, including misrepresenting the payment amount applicable to the
advertised mortgage and the nature or amount of cash available to the consumer in
connection with the advertised mortgage. PHLoans also made misrepresentations about the
existence and amount of fees or costs to the consumer in connection with the advertised
mortgage. The Bureau also found that PHLoans advertisements failed to properly disclose,
when required by Regulation Z, credit terms for the advertised mortgage, such as the
consumer's repayment obligations over the full term of the loan.

The consent order against PHLoans requires PHLoans to pay a civil penalty of $260,000. The
consent order also imposes injunctive relief to prevent future violations, including requiring
PHLoans to bolster its compliance functions by designating an advertising compliance
official who must review its mortgage advertisements for compliance with mortgage
advertising laws prior to their use; prohibiting misrepresentations similar to those identified
by the Bureau; and requiring PHLoans to comply with certain enhanced disclosure
requirements to prevent future misrepresentations.

The consent order against PHLoans can be found at:
https://files.consumerfinance.gov/f/documents/cfpb_phloans_consent-order_2020-08.pdf
(cfpb.gov/documents/9139/cfpb_phloans_consent-order_2020-08.pdf)

 

The consent order against Sovereign Lending Group, Inc. can be found at:
https://files.consumerfinance.gov/f/documents/cfpb_sovereign-lending-group_consent-

 
rder_2020-07.paf)

The consent order against Prime Choice Funding, Inc. can be found at:
https://files.consumerfinance.gov/f/documents/cfpb_prime-choice-funding_consent-

 

r_2020-07.pdf)

The consent order against Go Direct Lenders, Inc. can be found at:
https://files.consumerfinance.gov/f/documents/cfpb_go-direct-lenders_consent-

 

020-08. pdf)
HH

The Consumer Financial Protection Bureau (CFPB) is a 21st century agency that helps
consumer finance markets work by making rules more effective, by consistently and fairly
enforcing those rules, and by empowering consumers to take more control over their
economic lives. For more information, visit www.consumerfinance.gov.

 

 

PRESS INFORMATION

If you want to republish the article or have questions about the content, please contact the
press office.

Go to press resources page (cfpb.gov/about-us/newsroom/press-resources/)

 

An official website of the
United States government
",--ERROR--,"aug 26, 2020",consumer financial protection bureau settles with fourth mortgage company to address deceptive loan advertisements sent to servicemembers and veterans.,"washington, d.c. - today, the consumer financial protection bureau (bureau) issued a consent order against phloans.com, inc. (phloans), a california corporation that is licensed as a mortgage broker or lender in about 11 states. until at least april 2019, phloans was known as pacific home loans, inc. phloans offers and provides mortgage loans guaranteed by the united states department of veterans affairs (va). phloans's principal means of advertising va-guaranteed loans is through direct-mail advertisements sent primarily to united states military servicemembers and veterans. the bureau found that phloans sent consumers numerous mailers for va-guaranteed mortgages that contained false, misleading, and inaccurate statements or that lacked required disclosures, in violation of the consumer financial protection act's (cfpa) prohibition against deceptive acts and practices, the mortgage acts and practicesadvertising rule (map rule), and regulation z.
 the consent order requires phloans to pay a civil money penalty and imposes requirements to prevent future violations.
 today's action is the fourth case stemming from a bureau sweep of investigations of multiple mortgage companies that use deceptive mailers to advertise va-guaranteed mortgages. on july 24, 2020, the bureau announced consent orders against sovereign lending group, inc., and prime choice funding, inc., and on august 21, 2020, the bureau announced a consent order against go direct lenders, inc., for similar violations. the bureau commenced this sweep in response to concerns about potentially unlawful advertising in the market that the va identified. accurate and legally compliant advertising provides consumers with valuable information about the different types of mortgages and terms available so they can effectively shop for products that best meet their needs. this ongoing sweep of investigations reflects the bureau's commitment to enforcing the laws that ensure the financial marketplace is fair and accurate for all consumers, including servicemembers, veterans, and surviving spouses whom va-guaranteed mortgages are designed to benefit.
 the bureau found that phloans disseminated advertisements that contained false, misleading, and inaccurate statements or that failed to include required disclosures. for example, phloans advertisements misrepresented the credit terms of the advertised mortgage loan by stating credit terms that the company was not actually prepared to offer to the consumer, including misrepresenting the payment amount applicable to the advertised mortgage and the nature or amount of cash available to the consumer in connection with the advertised mortgage. phloans also made misrepresentations about the existence and amount of fees or costs to the consumer in connection with the advertised mortgage. the bureau also found that phloans advertisements failed to properly disclose, when required by regulation z, credit terms for the advertised mortgage, such as the consumer's repayment obligations over the full term of the loan.
 the consent order against phloans requires phloans to pay a civil penalty of $260,000. the consent order also imposes injunctive relief to prevent future violations, including requiring phloans to bolster its compliance functions by designating an advertising compliance official who must review its mortgage advertisements for compliance with mortgage advertising laws prior to their use; prohibiting misrepresentations similar to those identified by the bureau; and requiring phloans to comply with certain enhanced disclosure requirements to prevent future misrepresentations.
 the consent order against phloans can be found at: https://files.consumerfinance.gov/f/documents/cfpb_phloans_consent-order_2020-08.pdf (cfpb.gov/documents/9139/cfpb_phloans_consent-order_2020-08.pdf) the consent order against sovereign lending group, inc. can be found at: https://files.consumerfinance.gov/f/documents/cfpb_sovereign-lending-group_consent- rder_2020-07.paf) the consent order against prime choice funding, inc. can be found at: https://files.consumerfinance.gov/f/documents/cfpb_prime-choice-funding_consent- r_2020-07.pdf) the consent order against go direct lenders, inc. can be found at: https://files.consumerfinance.gov/f/documents/cfpb_go-direct-lenders_consent- 020-08. pdf) hh the consumer financial protection bureau (cfpb) is a 21st century agency that helps consumer finance markets work by making rules more effective, by consistently and fairly enforcing those rules, and by empowering consumers to take more control over their economic lives. for more information, visit www.consumerfinance.gov.
 press information if you want to republish the article or have questions about the content, please contact the press office.
 go to press resources page (cfpb.gov/about-us/newsroom/press-resources/) an official website of the united states government",--ERROR--,0
