folder,press_release_text,dd_folder,dd_date,dd_h1,dd_article,dd_end,dd_error
prime-choice-funding-inc,"cf Consumer Financial
Protection Bureau

 

Consumer Financial Protection Bureau Settles with Mortgage Companies to
Address Deceptive Loan Advertisements Sent to Servicemembers and Veterans

JUL 24, 2020

Washington, D.C. - Today, the Consumer Financial Protection Bureau (Bureau) issued
consent orders against Sovereign Lending Group, Inc. (Sovereign) and Prime Choice
Funding, Inc. (Prime Choice). Sovereign is a California corporation that is licensed as a
mortgage broker or lender in about 44 states and the District of Columbia. Prime Choice is
a California corporation that is licensed as a mortgage broker or lender in about 35 states
and the District of Columbia. Both companies offer and provide mortgage loans
guaranteed by the United States Department of Veterans Affairs (VA). Their principal means
of advertising VA-guaranteed loans is through direct-mail advertisements sent primarily to
United States military servicemembers and veterans. The Bureau found that the companies
mailed consumers advertisements for VA-guaranteed mortgages that contained false,
misleading, and inaccurate statements or lacked required disclosures, in violation of the
Consumer Financial Protection Act's (CFPA) prohibition against deceptive acts and
practices, the Mortgage Acts and Practices - Advertising Rule (MAP Rule), and Regulation Z.
The consent orders require the companies to pay civil money penalties and impose
requirements to prevent future violations.

Today’s actions stem from a Bureau sweep of investigations of multiple mortgage
companies that use deceptive mailers to advertise VA-guaranteed mortgages. The Bureau
commenced this sweep in response to concerns about potentially unlawful advertising in
the market that the VA identified. Accurate and legally compliant advertising provides
consumers with valuable information about the different types of mortgages and terms
available so they can effectively shop for products that best meet their needs. This ongoing
sweep of investigations reflects the Bureau’s commitment to enforcing the laws that ensure
the financial marketplace is fair and accurate for all consumers, including servicemembers,
veterans, and surviving spouses whom VA-guaranteed mortgages are designed to benefit.

The Bureau found that Sovereign and Prime disseminated advertisements that contained
false, misleading, and inaccurate statements or that failed to include required disclosures.
For example, Sovereign and Prime Choice advertisements misrepresented the credit terms
of the advertised mortgage loan by stating credit terms that the company was not actually
prepared to offer to the consumer. Sovereign and Prime Choice advertisements
misleadingly described an advertised introductory interest rate as a “fixed” rate, when in fact
the rate was adjustable and could increase over time. Sovereign and Prime Choice
advertisements also created the false impression that they were affiliated with the
government by using words, phrases, images, or designs that are associated with the VA or
the Internal Revenue Service.

The Bureau also found that both Sovereign and Prime Choice advertisements used the
name of the consumer's lender in a misleading way by not adequately disclosing their own
names and the fact that they were not associated with, or acting on behalf of, the
consumer's current lender, as required by Regulation Z. Sovereign advertisements made
false claims about consumer's existing loans, and falsely implied that the consumer could
address these problems by obtaining a loan from Sovereign. Sovereign and Prime Choice
advertisements also failed to properly disclose, when required by Regulation Z, credit terms
for the advertised mortgage, such as the consumer's repayment obligations over the full
term of the loan and the period during which certain interest rates would apply. Further,
Prime Choice advertisements created the false impression that they contained a property
assessment as well as misleading comparisons between hypothetical credit terms and the
terms of the advertised product.

The consent order against Sovereign requires Sovereign to pay a civil penalty of $460,000.
The consent order against Prime Choice requires Prime Choice to pay a civil penalty of
$645,000. The consent orders also impose injunctive relief to prevent future violations,
including requiring the companies to bolster their compliance functions by designating an
advertising compliance official who must review their mortgage advertisements for
compliance with mortgage advertising laws prior to their use; prohibiting
misrepresentations similar to those identified by the Bureau; and requiring the companies
to comply with certain enhanced disclosure requirements to prevent them from making
future misrepresentations.

The consent order against Sovereign can be found at:
https://files.consumerfinance.gov/f/documents/cfpb_sovereign-lending-group_consent-

 

rder_2020-07.pdf)

The consent order against Prime Choice can be found at:
https://files.consumerfinance.gov/f/documents/cfpb_prime-choice-funding_consent-

 

r_2020-07.pdf)
HH

The Consumer Financial Protection Bureau (CFPB) is a 21st century agency that helps
consumer finance markets work by making rules more effective, by consistently and fairly
enforcing those rules, and by empowering consumers to take more control over their
economic lives. For more information, visit www.consumerfinance.gov.

 

 

PRESS INFORMATION

If you want to republish the article or have questions about the content, please contact the
press office.

Go to press resources page (cfpb.gov/about-us/newsroom/press-resources/)

 

An official website of the
United States government
",--ERROR--,"jul 24, 2020",consumer financial protection bureau settles with mortgage companies to address deceptive loan advertisements sent to servicemembers and veterans.,"washington, d.c. - today, the consumer financial protection bureau (bureau) issued consent orders against sovereign lending group, inc. (sovereign) and prime choice funding, inc. (prime choice). sovereign is a california corporation that is licensed as a mortgage broker or lender in about 44 states and the district of columbia. prime choice is a california corporation that is licensed as a mortgage broker or lender in about 35 states and the district of columbia. both companies offer and provide mortgage loans guaranteed by the united states department of veterans affairs (va). their principal means of advertising va-guaranteed loans is through direct-mail advertisements sent primarily to united states military servicemembers and veterans. the bureau found that the companies mailed consumers advertisements for va-guaranteed mortgages that contained false, misleading, and inaccurate statements or lacked required disclosures, in violation of the consumer financial protection act's (cfpa) prohibition against deceptive acts and practices, the mortgage acts and practices - advertising rule (map rule), and regulation z.
 the consent orders require the companies to pay civil money penalties and impose requirements to prevent future violations.
 today's actions stem from a bureau sweep of investigations of multiple mortgage companies that use deceptive mailers to advertise va-guaranteed mortgages. the bureau commenced this sweep in response to concerns about potentially unlawful advertising in the market that the va identified. accurate and legally compliant advertising provides consumers with valuable information about the different types of mortgages and terms available so they can effectively shop for products that best meet their needs. this ongoing sweep of investigations reflects the bureau's commitment to enforcing the laws that ensure the financial marketplace is fair and accurate for all consumers, including servicemembers, veterans, and surviving spouses whom va-guaranteed mortgages are designed to benefit.
 the bureau found that sovereign and prime disseminated advertisements that contained false, misleading, and inaccurate statements or that failed to include required disclosures.
 for example, sovereign and prime choice advertisements misrepresented the credit terms of the advertised mortgage loan by stating credit terms that the company was not actually prepared to offer to the consumer. sovereign and prime choice advertisements misleadingly described an advertised introductory interest rate as a ""fixed"" rate, when in fact the rate was adjustable and could increase over time. sovereign and prime choice advertisements also created the false impression that they were affiliated with the government by using words, phrases, images, or designs that are associated with the va or the internal revenue service.
 the bureau also found that both sovereign and prime choice advertisements used the name of the consumer's lender in a misleading way by not adequately disclosing their own names and the fact that they were not associated with, or acting on behalf of, the consumer's current lender, as required by regulation z. sovereign advertisements made false claims about consumer's existing loans, and falsely implied that the consumer could address these problems by obtaining a loan from sovereign. sovereign and prime choice advertisements also failed to properly disclose, when required by regulation z, credit terms for the advertised mortgage, such as the consumer's repayment obligations over the full term of the loan and the period during which certain interest rates would apply. further, prime choice advertisements created the false impression that they contained a property assessment as well as misleading comparisons between hypothetical credit terms and the terms of the advertised product.
 the consent order against sovereign requires sovereign to pay a civil penalty of $460,000.
 the consent order against prime choice requires prime choice to pay a civil penalty of $645,000. the consent orders also impose injunctive relief to prevent future violations, including requiring the companies to bolster their compliance functions by designating an advertising compliance official who must review their mortgage advertisements for compliance with mortgage advertising laws prior to their use; prohibiting misrepresentations similar to those identified by the bureau; and requiring the companies to comply with certain enhanced disclosure requirements to prevent them from making future misrepresentations.
 the consent order against sovereign can be found at: https://files.consumerfinance.gov/f/documents/cfpb_sovereign-lending-group_consent- rder_2020-07.pdf) the consent order against prime choice can be found at: https://files.consumerfinance.gov/f/documents/cfpb_prime-choice-funding_consent- r_2020-07.pdf) hh the consumer financial protection bureau (cfpb) is a 21st century agency that helps consumer finance markets work by making rules more effective, by consistently and fairly enforcing those rules, and by empowering consumers to take more control over their economic lives. for more information, visit www.consumerfinance.gov.
 press information if you want to republish the article or have questions about the content, please contact the press office.
 go to press resources page (cfpb.gov/about-us/newsroom/press-resources/) an official website of the united states government",--ERROR--,0
nationstar-mortgage-llc-dba-mr-cooper,"cf b Consumer Financial
Protection Bureau

 

Consumer Financial Protection Bureau and Multiple States Enter into Settlement
with Nationstar Mortgage, LLC for Unlawful Servicing Practices

DEC 07, 2020

WASHINGTON, D.C. — Today the Consumer Financial Protection Bureau (Bureau) filed a
complaint and proposed stipulated judgment and order against Nationstar Mortgage, LLC,
which does business as Mr. Cooper (Nationstar). The Bureau’s action is part of a
coordinated effort between the Bureau, a multistate group of state attorneys general, and
state bank regulators. The Bureau alleges that Nationstar violated multiple Federal
consumer financial laws, causing substantial harm to the borrowers whose mortgage loans it
serviced, including distressed homeowners. Nationstar is one of the nation’s largest
mortgage servicers and the largest non-bank mortgage servicer in the United States. The
proposed judgment and order, if entered by the court, would require Nationstar to pay
approximately $73 million in redress to more than 40,000 harmed borrowers. It would also
require Nationstar to pay a $1.5 million civil penalty to the Bureau. Attorneys general from
all 50 states and the District of Columbia and bank regulators from 53 jurisdictions covering
48 states and Puerto Rico, the Virgin Islands, and the District of Columbia have also settled
with Nationstar today and their settlements are reflected in separate actions, concurrently
filed in the United States District Court for the District of Columbia.

“Mortgage servicers are entrusted with handling significant financial transactions for millions
of Americans, including struggling homeowners. Nationstar broke that trust by engaging in
unfair and deceptive practices prohibited by the Consumer Financial Protection Act of

2010, as well as violations of the Real Estate Settlement Procedures Act and the
Homeowner's Protection Act,” said CFPB Director Kathleen L. Kraninger. “Today's action is
the culmination of a multi-year effort working with our state partners to investigate
Nationstar’s failings, which resulted in substantial consumer harm. We had a strong
partnership with our state counterparts in this case and | thank them for all their support in
this case.”

“This settlement demonstrates the crucial role of state financial services regulators in
ensuring that homeowners are protected as they obtain and pay down their mortgages—
especially homeowners who may be struggling with making their payments,” said Illinois
Department of Financial and Professional Regulation Secretary Deborah Hagan. “This
resolution demonstrates that a commitment to government coordination provides a path to
efficient, effective, and comprehensive outcomes for both consumers and for Mr. Cooper,
who will be held to the highest operational standards as it continues to provide mortgage
services across the nation.”

The Bureau’s and States’ proposed judgments and orders, if entered by the court, will yield
nearly $85 million in recoveries for consumers to date and over $6 million more in fees and
penalties. They are also part of a larger government effort, which also includes assistance
from the Special Inspector General for the Troubled Asset Relief Program (SIGTARP) and
the United States Trustee Program, to address Nationstar’s alleged unlawful mortgage loan
servicing practices.

In its complaint, filed in federal district court in the District of Columbia, the Bureau alleges
that Nationstar engaged in unfair and deceptive acts and practices in violation of the
Consumer Financial Protection Act of 2010, violated the Real Estate Settlement Procedures
Act (RESPA), and violated the Homeowner's Protection Act of 1998 (HPA). Specifically, the
Bureau alleges that between January 2012 and January 1, 2016, in numerous instances
Nationstar failed to identify loans on its systems that had pending loss-mitigation
applications or trial-modification plans, and as a result failed to honor borrowers’ loan
modification agreements. Nationstar allegedly foreclosed on borrowers to whom it had
promised it would not foreclose while their loss mitigation applications were pending.
Nationstar also allegedly improperly increased borrowers’ permanent, modified monthly
loan payments, mispresented to borrowers when they would be eligible to have their
private mortgage insurance premiums canceled, and failed to timely remove private
mortgage insurance from borrowers’ accounts. Nationstar allegedly failed to timely disburse
borrowers’ tax payments from their escrow accounts and failed to properly conduct escrow
analyses for borrowers during their Chapter 13 bankruptcy proceedings.

If entered by the court, Nationstar would be required to immediately set aside about $15.6
million to pay borrowers it has not remediated prior to the order's effective date and to
certify that it has already paid approximately $57.5 million in redress to other borrowers
affected by the conduct alleged in the complaint. The stipulated judgment and order would
also require Nationstar, among other things, to enhance its policies and processes including
with respect to handling consumer complaints and disputes, conducting escrow analyses
on borrowers’ accounts, transferring information during servicing transfers, offering loss
mitigation, and terminating borrowers’ private mortgage insurance.

To read the complaint click here:
https://files.consumerfinance.gov/f/documents/cfpb_nationstar-mortgage-llc-dba-mr-
cooper_complaint_2020-12.pdf i (cfpb.gov/documents/9396/cfpb_nationstar-mortgage-ll
c-dba-mr-cooper_complaint_2020-12.pdf)

 

 

To read the proposed stipulated judgement and order click here:
https://files.consumerfinance.gov/f/documents/cfpb_nationstar-mortgage-llc-dba-mr-
cooper _stipulated-final-judgment-and-order_2020-12.pdf (cfpb.gov/documents/9397/cf
pb_nationstar-mortgage-llc-dba-mr-cooper_stipulated-final-judgment-and-order_2020-12.
pdf)

 

 

tHE

The Consumer Financial Protection Bureau (CFPB) is a 21st century agency that helps
consumer finance markets work by making rules more effective, by consistently and fairly
enforcing those rules, and by empowering consumers to take more control over their
economic lives. For more information, visit www.consumerfinance.gov.

 

 

PRESS INFORMATION

If you want to republish the article or have questions about the content, please contact the
press office.

Go to press resources page (cfpb.gov/about-us/newsroom/press-resources/)

 

An official website of the
United States government
",--ERROR--,"dec 07, 2020","consumer financial protection bureau and multiple states enter into settlement with nationstar mortgage, llc for unlawful servicing practices.","washington, d.c. today the consumer financial protection bureau (bureau) filed a complaint and proposed stipulated judgment and order against nationstar mortgage, llc, which does business as mr. cooper (nationstar). the bureau's action is part of a coordinated effort between the bureau, a multistate group of state attorneys general, and state bank regulators. the bureau alleges that nationstar violated multiple federal consumer financial laws, causing substantial harm to the borrowers whose mortgage loans it serviced, including distressed homeowners. nationstar is one of the nation's largest mortgage servicers and the largest non-bank mortgage servicer in the united states. the proposed judgment and order, if entered by the court, would require nationstar to pay approximately $73 million in redress to more than 40,000 harmed borrowers. it would also require nationstar to pay a $1.5 million civil penalty to the bureau. attorneys general from all 50 states and the district of columbia and bank regulators from 53 jurisdictions covering 48 states and puerto rico, the virgin islands, and the district of columbia have also settled with nationstar today and their settlements are reflected in separate actions, concurrently filed in the united states district court for the district of columbia.
 ""mortgage servicers are entrusted with handling significant financial transactions for millions of americans, including struggling homeowners. nationstar broke that trust by engaging in unfair and deceptive practices prohibited by the consumer financial protection act of 2010, as well as violations of the real estate settlement procedures act and the homeowner's protection act,"" said cfpb director kathleen l. kraninger. ""today's action is the culmination of a multi-year effort working with our state partners to investigate nationstar's failings, which resulted in substantial consumer harm. we had a strong partnership with our state counterparts in this case and | thank them for all their support in this case."" ""this settlement demonstrates the crucial role of state financial services regulators in ensuring that homeowners are protected as they obtain and pay down their mortgages especially homeowners who may be struggling with making their payments,"" said illinois department of financial and professional regulation secretary deborah hagan. ""this resolution demonstrates that a commitment to government coordination provides a path to efficient, effective, and comprehensive outcomes for both consumers and for mr. cooper, who will be held to the highest operational standards as it continues to provide mortgage services across the nation."" the bureau's and states' proposed judgments and orders, if entered by the court, will yield nearly $85 million in recoveries for consumers to date and over $6 million more in fees and penalties. they are also part of a larger government effort, which also includes assistance from the special inspector general for the troubled asset relief program (sigtarp) and the united states trustee program, to address nationstar's alleged unlawful mortgage loan servicing practices.
 in its complaint, filed in federal district court in the district of columbia, the bureau alleges that nationstar engaged in unfair and deceptive acts and practices in violation of the consumer financial protection act of 2010, violated the real estate settlement procedures act (respa), and violated the homeowner's protection act of 1998 (hpa). specifically, the bureau alleges that between january 2012 and january 1, 2016, in numerous instances nationstar failed to identify loans on its systems that had pending loss-mitigation applications or trial-modification plans, and as a result failed to honor borrowers' loan modification agreements. nationstar allegedly foreclosed on borrowers to whom it had promised it would not foreclose while their loss mitigation applications were pending.
 nationstar also allegedly improperly increased borrowers' permanent, modified monthly loan payments, mispresented to borrowers when they would be eligible to have their private mortgage insurance premiums canceled, and failed to timely remove private mortgage insurance from borrowers' accounts. nationstar allegedly failed to timely disburse borrowers' tax payments from their escrow accounts and failed to properly conduct escrow analyses for borrowers during their chapter 13 bankruptcy proceedings.
 if entered by the court, nationstar would be required to immediately set aside about $15.6 million to pay borrowers it has not remediated prior to the order's effective date and to certify that it has already paid approximately $57.5 million in redress to other borrowers affected by the conduct alleged in the complaint. the stipulated judgment and order would also require nationstar, among other things, to enhance its policies and processes including with respect to handling consumer complaints and disputes, conducting escrow analyses on borrowers' accounts, transferring information during servicing transfers, offering loss mitigation, and terminating borrowers' private mortgage insurance.
 to read the complaint click here: https://files.consumerfinance.gov/f/documents/cfpb_nationstar-mortgage-llc-dba-mr- cooper_complaint_2020-12.pdf i (cfpb.gov/documents/9396/cfpb_nationstar-mortgage-ll c-dba-mr-cooper_complaint_2020-12.pdf) to read the proposed stipulated judgement and order click here: https://files.consumerfinance.gov/f/documents/cfpb_nationstar-mortgage-llc-dba-mr- cooper _stipulated-final-judgment-and-order_2020-12.pdf (cfpb.gov/documents/9397/cf pb_nationstar-mortgage-llc-dba-mr-cooper_stipulated-final-judgment-and-order_2020-12.
 pdf) the the consumer financial protection bureau (cfpb) is a 21st century agency that helps consumer finance markets work by making rules more effective, by consistently and fairly enforcing those rules, and by empowering consumers to take more control over their economic lives. for more information, visit www.consumerfinance.gov.
 press information if you want to republish the article or have questions about the content, please contact the press office.
 go to press resources page (cfpb.gov/about-us/newsroom/press-resources/) an official website of the united states government",--ERROR--,0
