folder,press_release_text,dd_folder,dd_date,dd_h1,dd_article,dd_end,dd_error
sigue-corporation-sgs-corporation-groupex-corporation,"cf b Consumer Financial
Protection Bureau

 

Consumer Financial Protection Bureau Settles with Remittance Transfer Providers
for Remittance Transfer Rule Violations

AUG 31, 2020

WASHINGTON, D.C. — Today the Consumer Financial Protection Bureau (Bureau) entered
into settlements with Trans-Fast Remittance LLC and Sigue Corporation and its subsidiaries,
SGS Corporation and GroupEx Corporation. Trans-Fast, which until recently was a
remittance transfer provider, is based in New York, New York and licensed in over 30 states.
Sigue and its subsidiaries, which are all headquartered in Sylmar, California, provide
consumers with international money-transfer services, including remittance-transfer
services. The Bureau found that Trans-Fast and Sigue and its subsidiaries violated the
Electronic Fund Transfer Act (EFTA) and the Remittance Transfer Rule, which implements
EFTA. The Bureau also found that Trans-Fast violated the Consumer Financial Protection Act
of 2010's (CFPA) prohibition against deceptive acts or practices. The consent orders require
the companies to pay civil money penalties and impose requirements to prevent future
violations. Sigue and its subsidiaries must also pay consumer redress. These actions reflect a
sweep of enforcement actions to address violations of the Remittance Transfer Rule.

The Bureau’s investigation of Trans-Fast found that it violated EFTA and the Remittance
Transfer Rule by failing to adhere to error resolution requirements and properly respond to
cancellation requests, failing to provide refunds the Remittance Transfer Rule requires,
failing to maintain required policies and procedures, and failing to provide required
disclosures. Since the 2013 effective date of the Remittance Transfer Rule, Trans-Fast
provided about 40 million disclosures to consumers that violated the Remittance Transfer
Rule. The Bureau also found that Trans-Fast engaged in deceptive acts or practices in
violation of the CFPA by making misleading statements in advertisements regarding the
speed of its remittance transfers and making misleading statements in disclosures
purporting to limit consumers’ error resolution rights.

The Bureau’s investigation of Sigue and its subsidiaries found that between 2013 and 2019,
they violated EFTA and the Remittance Transfer Rule. Specifically, the Bureau found that
Sigue and its subsidiaries failed to refund transaction fees when they did not make funds
available by the disclosed date of availability, and they failed to inform consumers of the
remedies available for remittance errors. When Sigue and its subsidiaries investigated
remittance errors, they failed to report to consumers in writing the results of their
investigations into transaction errors or consumers’ rights as required by the Rule. Sigue
and its subsidiaries also failed to develop and maintain adequate written policies and
procedures designed to ensure compliance with certain Remittance Transfer Rule error-
resolution requirements and failed to comply with several Remittance Transfer Rule
disclosure requirements.

The consent order against Trans-Fast requires it to pay a $1.6 million civil money penalty. If
Trans-Fast resumes offering remittance transfers, the consent order requires it to adopt a
compliance plan to ensure that its remittance transfer acts and practices comply with all
applicable Federal consumer financial laws and the consent order.

The consent order against Sigue and its subsidiaries requires them to pay about $100,000
in consumer redress and a $300,000 civil money penalty. They must also implement and
maintain written policies and procedures designed to ensure compliance with the
Remittance Transfer Rule and maintain a compliance-management system that is designed
to ensure that their operations comply with the Remittance Transfer Rule, including
conducting training and oversight of all agents, employees, and service providers, and not
violating the Remittance Transfer Rule in the future.

The consent order against Trans-Fast Remittance LLC is available at:
https://files.consumerfinance.gov/f/documents/cfpb_trans-fast-remittance-llc_consent-

 

der_2020-08.pdf)
The consent order against Sigue Corporation and its subsidiaries is available at:
https://files.consumerfinance.gov/f/documents/cfpb_sigue-corporation_consent-

020-08.pdf)
HHH

The Consumer Financial Protection Bureau (CFPB) is a 21st century agency that helps
consumer finance markets work by making rules more effective, by consistently and fairly
enforcing those rules, and by empowering consumers to take more control over their
economic lives. For more information, visit www.consumerfinance.gov.

 

 

PRESS INFORMATION

If you want to republish the article or have questions about the content, please contact the
press office.

Go to press resources page (cfpb.gov/about-us/newsroom/press-resources/)

 

An official website of the
United States government
",--ERROR--,"aug 31, 2020",consumer financial protection bureau settles with remittance transfer providers for remittance transfer rule violations.,"washington, d.c. today the consumer financial protection bureau (bureau) entered into settlements with trans-fast remittance llc and sigue corporation and its subsidiaries, sgs corporation and groupex corporation. trans-fast, which until recently was a remittance transfer provider, is based in new york, new york and licensed in over 30 states.
 sigue and its subsidiaries, which are all headquartered in sylmar, california, provide consumers with international money-transfer services, including remittance-transfer services. the bureau found that trans-fast and sigue and its subsidiaries violated the electronic fund transfer act (efta) and the remittance transfer rule, which implements efta. the bureau also found that trans-fast violated the consumer financial protection act of 2010's (cfpa) prohibition against deceptive acts or practices. the consent orders require the companies to pay civil money penalties and impose requirements to prevent future violations. sigue and its subsidiaries must also pay consumer redress. these actions reflect a sweep of enforcement actions to address violations of the remittance transfer rule.
 the bureau's investigation of trans-fast found that it violated efta and the remittance transfer rule by failing to adhere to error resolution requirements and properly respond to cancellation requests, failing to provide refunds the remittance transfer rule requires, failing to maintain required policies and procedures, and failing to provide required disclosures. since the 2013 effective date of the remittance transfer rule, trans-fast provided about 40 million disclosures to consumers that violated the remittance transfer rule. the bureau also found that trans-fast engaged in deceptive acts or practices in violation of the cfpa by making misleading statements in advertisements regarding the speed of its remittance transfers and making misleading statements in disclosures purporting to limit consumers' error resolution rights.
 the bureau's investigation of sigue and its subsidiaries found that between 2013 and 2019, they violated efta and the remittance transfer rule. specifically, the bureau found that sigue and its subsidiaries failed to refund transaction fees when they did not make funds available by the disclosed date of availability, and they failed to inform consumers of the remedies available for remittance errors. when sigue and its subsidiaries investigated remittance errors, they failed to report to consumers in writing the results of their investigations into transaction errors or consumers' rights as required by the rule. sigue and its subsidiaries also failed to develop and maintain adequate written policies and procedures designed to ensure compliance with certain remittance transfer rule error- resolution requirements and failed to comply with several remittance transfer rule disclosure requirements.
 the consent order against trans-fast requires it to pay a $1.6 million civil money penalty. if trans-fast resumes offering remittance transfers, the consent order requires it to adopt a compliance plan to ensure that its remittance transfer acts and practices comply with all applicable federal consumer financial laws and the consent order.
 the consent order against sigue and its subsidiaries requires them to pay about $100,000 in consumer redress and a $300,000 civil money penalty. they must also implement and maintain written policies and procedures designed to ensure compliance with the remittance transfer rule and maintain a compliance-management system that is designed to ensure that their operations comply with the remittance transfer rule, including conducting training and oversight of all agents, employees, and service providers, and not violating the remittance transfer rule in the future.
 the consent order against trans-fast remittance llc is available at: https://files.consumerfinance.gov/f/documents/cfpb_trans-fast-remittance-llc_consent- der_2020-08.pdf) the consent order against sigue corporation and its subsidiaries is available at: https://files.consumerfinance.gov/f/documents/cfpb_sigue-corporation_consent- 020-08.pdf) hhh the consumer financial protection bureau (cfpb) is a 21st century agency that helps consumer finance markets work by making rules more effective, by consistently and fairly enforcing those rules, and by empowering consumers to take more control over their economic lives. for more information, visit www.consumerfinance.gov.
 press information if you want to republish the article or have questions about the content, please contact the press office.
 go to press resources page (cfpb.gov/about-us/newsroom/press-resources/) an official website of the united states government",--ERROR--,0
candy-kern-fuller-howard-sutter-iii-and-upstate-law-group-llc,"cf b Consumer Financial
Protection Bureau

 

Consumer Financial Protection Bureau, South Carolina, and Arkansas File Suit
Against Brokers of High-Interest Credit Offers

FEB 20, 2020

WASHINGTON, D.C. - The Consumer Financial Protection Bureau (Bureau), the South
Carolina Department of Consumer Affairs (South Carolina), and Arkansas Attorney General
Leslie Rutledge today filed a lawsuit in federal district court in the District of South Carolina
against Candy Kern-Fuller, Howard Sutter Ill, and Upstate Law Group LLC. The Bureau
alleges that the defendants worked with a series of companies that brokered contracts
offering high-interest credit to consumers, primarily disabled veterans, and violated the
Consumer Financial Protection Act's prohibition against deceptive acts or practices and
against providing substantial assistance to deceptive and unfair acts or practices of others.

Today’s action builds on a number of recent Bureau actions against other entities that used
similar contracts and similar marketing tactics in offering high-interest credit to veterans. In
January 2019, the Bureau settled with Mark Corbett. In August 2019, in partnership with
Arkansas, the Bureau settled with Andrew Gamber; Voyager Financial Group, LLC; BAIC,
Inc.; and SoBell Corp. In October 2019, in partnership with South Carolina, the Bureau filed
a lawsuit against Katharine Snyder and her companies, Performance Arbitrage Company,
Inc. and Life Funding Options, Inc. Corbett worked with both Gamber and Snyder, and their
respective companies, to broker contracts offering high-interest credit. In each of these
actions, the Bureau alleged that these contracts violate laws that prohibit these transactions
and render them void, contrary to the representations made by Corbett, Gamber, Snyder,
and their companies that the transactions were valid and enforceable. In these actions, the
Bureau also alleged that the companies misrepresented to consumers that the product is a
sale of payments and not a high-interest credit offer and failed to inform consumers of the
products’ interest rates. To date, the Bureau Civil Penalty Fund has allocated about $9
million to consumers harmed by Corbett's actions and about $2.7 million to those harmed
by Gamber’s actions.

In today’s action, the Bureau, South Carolina, and Arkansas allege that the defendants
assisted Gamber, Snyder, and their companies. The Bureau specifically alleges that the
defendants provided substantial assistance to the companies’ deceptive and unfair acts or
practices by: developing a pre-approval or risk-assessment process for the contracts and
conducting underwriting; approving or denying consumers’ applications to enter into the
transactions; directing and administering the execution of the contracts; serving as the
payment processor for the initial lump-sum payment and fees; and continuing to serve as
the transactions’ payment processor. In addition, the Bureau alleges that the defendants
provided substantial assistance to deceptive misrepresentations by Gamber’s and Snyder's
companies to consumers that consumers may be subject to criminal prosecution if they
breached their contacts when, in fact, the consumers could not be criminally prosecuted for
breaching their contracts. The Bureau also alleges that the defendants committed deceptive
acts or practices by collecting on the contracts brokered by the companies, including by
filing suit when consumers failed to make payments, and representing, expressly or
impliedly, that consumers are legally obligated to make payments in accordance with the
terms of their contracts when, in fact, the contracts are void from inception and consumers
are not obligated to make payments. The complaint seeks an injunction, redress to
consumers, and the imposition of civil money penalties.

The Bureau’s investigation was conducted in partnership with South Carolina and Arkansas.
The complaint is not a finding or ruling that the defendants have violated the law.

A copy of the complaint filed in the United States District Court for the District of South
Carolina is available here: https://files.consumerfinance.gov/f/documents/cfpb_kern-
fuller_complaint_2020-02.pdf WY (cfpb.gov/documents/8532/cfpb_kern-fuller_complaint_20
20-02.pdf).

 

 

tHE
The Consumer Financial Protection Bureau (CFPB) is a 21st century agency that helps
consumer finance markets work by making rules more effective, by consistently and fairly
enforcing those rules, and by empowering consumers to take more control over their
economic lives. For more information, visit www.consumerfinance.gov.

 

 

PRESS INFORMATION

If you want to republish the article or have questions about the content, please contact the
press office.

Go to press resources page (cfpb.gov/about-us/newsroom/press-resources/)

 

li

An official website of the
United States government
",--ERROR--,"feb 20, 2020","consumer financial protection bureau, south carolina, and arkansas file suit against brokers of high-interest credit offers.","washington, d.c. - the consumer financial protection bureau (bureau), the south carolina department of consumer affairs (south carolina), and arkansas attorney general leslie rutledge today filed a lawsuit in federal district court in the district of south carolina against candy kern-fuller, howard sutter ill, and upstate law group llc. the bureau alleges that the defendants worked with a series of companies that brokered contracts offering high-interest credit to consumers, primarily disabled veterans, and violated the consumer financial protection act's prohibition against deceptive acts or practices and against providing substantial assistance to deceptive and unfair acts or practices of others.
 today's action builds on a number of recent bureau actions against other entities that used similar contracts and similar marketing tactics in offering high-interest credit to veterans. in january 2019, the bureau settled with mark corbett. in august 2019, in partnership with arkansas, the bureau settled with andrew gamber; voyager financial group, llc; baic, inc.; and sobell corp. in october 2019, in partnership with south carolina, the bureau filed a lawsuit against katharine snyder and her companies, performance arbitrage company, inc. and life funding options, inc. corbett worked with both gamber and snyder, and their respective companies, to broker contracts offering high-interest credit. in each of these actions, the bureau alleged that these contracts violate laws that prohibit these transactions and render them void, contrary to the representations made by corbett, gamber, snyder, and their companies that the transactions were valid and enforceable. in these actions, the bureau also alleged that the companies misrepresented to consumers that the product is a sale of payments and not a high-interest credit offer and failed to inform consumers of the products' interest rates. to date, the bureau civil penalty fund has allocated about $9 million to consumers harmed by corbett's actions and about $2.7 million to those harmed by gamber's actions.
 in today's action, the bureau, south carolina, and arkansas allege that the defendants assisted gamber, snyder, and their companies. the bureau specifically alleges that the defendants provided substantial assistance to the companies' deceptive and unfair acts or practices by: developing a pre-approval or risk-assessment process for the contracts and conducting underwriting; approving or denying consumers' applications to enter into the transactions; directing and administering the execution of the contracts; serving as the payment processor for the initial lump-sum payment and fees; and continuing to serve as the transactions' payment processor. in addition, the bureau alleges that the defendants provided substantial assistance to deceptive misrepresentations by gamber's and snyder's companies to consumers that consumers may be subject to criminal prosecution if they breached their contacts when, in fact, the consumers could not be criminally prosecuted for breaching their contracts. the bureau also alleges that the defendants committed deceptive acts or practices by collecting on the contracts brokered by the companies, including by filing suit when consumers failed to make payments, and representing, expressly or impliedly, that consumers are legally obligated to make payments in accordance with the terms of their contracts when, in fact, the contracts are void from inception and consumers are not obligated to make payments. the complaint seeks an injunction, redress to consumers, and the imposition of civil money penalties.
 the bureau's investigation was conducted in partnership with south carolina and arkansas.
 the complaint is not a finding or ruling that the defendants have violated the law.
 a copy of the complaint filed in the united states district court for the district of south carolina is available here: https://files.consumerfinance.gov/f/documents/cfpb_kern- fuller_complaint_2020-02.pdf wy (cfpb.gov/documents/8532/cfpb_kern-fuller_complaint_20 20-02.pdf).
 the the consumer financial protection bureau (cfpb) is a 21st century agency that helps consumer finance markets work by making rules more effective, by consistently and fairly enforcing those rules, and by empowering consumers to take more control over their economic lives. for more information, visit www.consumerfinance.gov.
 press information if you want to republish the article or have questions about the content, please contact the press office.
 go to press resources page (cfpb.gov/about-us/newsroom/press-resources/) li an official website of the united states government",--ERROR--,0
bounceback-inc,"cf b Consumer Financial
Protection Bureau

 

Consumer Financial Protection Bureau Sues Debt Collector BounceBack, Inc.

DEC 09, 2020

WASHINGTON, D.C. —- Today, the Consumer Financial Protection Bureau (Bureau) filed a
lawsuit against BounceBack, Inc. for allegedly engaging in deceptive and otherwise
unlawful debt collection acts or practices. BounceBack, based in Kansas City, Missouri,
operates bad-check pretrial-diversion programs on behalf of more than 90 district
attorneys’ offices throughout the United States. The Bureau alleges that in the course of
implementing this program, BounceBack violated the Fair Debt Collection Practices Act
(FDCPA) and the Consumer Financial Protection Act of 2010 (CFPA). The Bureau’s
complaint seeks injunctions against BounceBack, as well as damages, redress to consumers,
disgorgement of ill-gotten gains, and the imposition of a civil money penalty.

The Bureau filed its complaint in federal court in the Western District of Missouri. The
complaint alleges that since at least 2015, in the course of administering these bad-check
pretrial-diversion programs, BounceBack used district-attorney letterheads to threaten
more than 19,000 consumers with prosecution if they did not pay the amount of the check,
enroll and pay for a financial-education course, and pay various other fees. BounceBack did
not reveal to consumers that BounceBack—and not district attorneys—sent the letters. Nor
did BounceBack reveal that district attorneys almost never prosecuted these cases, even
when consumers ignored BounceBack’s threats. In fact, in most cases, BounceBack did not
refer cases for prosecution, even if the check writer failed to respond to its collection letter.
BounceBack’s letters also failed to include disclosures required under the FDCPA. The
Bureau alleges that BounceBack’s conduct violated the FDCPA, was deceptive under both
the FDCPA and the CFPA, and that its violations of the FDCPA constituted violations of the
CFPA.

The complaint is not a finding or ruling that the defendant has violated the law.

A copy of the complaint is available at:
https://files.consumerfinance.gov/f/documents/cfpb_bounceback-inc_complaint_2020-

 

ttt

The Consumer Financial Protection Bureau (CFPB) is a 21st century agency that helps
consumer finance markets work by making rules more effective, by consistently and fairly
enforcing those rules, and by empowering consumers to take more control over their
economic lives. For more information, visit www.consumerfinance.gov.

 

 

PRESS INFORMATION

If you want to republish the article or have questions about the content, please contact the
press office.

Go to press resources page (cfpb.gov/about-us/newsroom/press-resources/)
 

An official website of the
United States government
",--ERROR--,"dec 09, 2020","consumer financial protection bureau sues debt collector bounceback, inc.","washington, d.c. - today, the consumer financial protection bureau (bureau) filed a lawsuit against bounceback, inc. for allegedly engaging in deceptive and otherwise unlawful debt collection acts or practices. bounceback, based in kansas city, missouri, operates bad-check pretrial-diversion programs on behalf of more than 90 district attorneys' offices throughout the united states. the bureau alleges that in the course of implementing this program, bounceback violated the fair debt collection practices act (fdcpa) and the consumer financial protection act of 2010 (cfpa). the bureau's complaint seeks injunctions against bounceback, as well as damages, redress to consumers, disgorgement of ill-gotten gains, and the imposition of a civil money penalty.
 the bureau filed its complaint in federal court in the western district of missouri. the complaint alleges that since at least 2015, in the course of administering these bad-check pretrial-diversion programs, bounceback used district-attorney letterheads to threaten more than 19,000 consumers with prosecution if they did not pay the amount of the check, enroll and pay for a financial-education course, and pay various other fees. bounceback did not reveal to consumers that bouncebackand not district attorneyssent the letters. nor did bounceback reveal that district attorneys almost never prosecuted these cases, even when consumers ignored bounceback's threats. in fact, in most cases, bounceback did not refer cases for prosecution, even if the check writer failed to respond to its collection letter.
 bounceback's letters also failed to include disclosures required under the fdcpa. the bureau alleges that bounceback's conduct violated the fdcpa, was deceptive under both the fdcpa and the cfpa, and that its violations of the fdcpa constituted violations of the cfpa.
 the complaint is not a finding or ruling that the defendant has violated the law.
 a copy of the complaint is available at: https://files.consumerfinance.gov/f/documents/cfpb_bounceback-inc_complaint_2020- ttt the consumer financial protection bureau (cfpb) is a 21st century agency that helps consumer finance markets work by making rules more effective, by consistently and fairly enforcing those rules, and by empowering consumers to take more control over their economic lives. for more information, visit www.consumerfinance.gov.
 press information if you want to republish the article or have questions about the content, please contact the press office.
 go to press resources page (cfpb.gov/about-us/newsroom/press-resources/) an official website of the united states government",--ERROR--,0
