folder,press_release_text,dd_folder,dd_date,dd_h1,dd_article,dd_end,dd_error
driver-loan-llc-angelo-jose-sarjeant,"cf b Consumer Financial
Protection Bureau

 

Consumer Financial Protection Bureau Files Lawsuit Against Driver Loan, LLC And
Its CEO

NOV 05, 2020

WASHINGTON, D.C. - The Consumer Financial Protection Bureau (Bureau) today filed a
lawsuit against Driver Loan, LLC, and its Chief Executive Officer, Angelo Jose Sarjeant, for
allegedly engaging in deceptive acts or practices in taking deposits from and offering credit
to consumers. Driver Loan, based in Doral, Florida, offers short-term, high-interest loans to
consumers funded by deposits made by other consumers. The Bureau alleges that Driver
Loan and Sarjeant violated the Consumer Financial Protection Act of 2010 (CFPA) by
misrepresenting the risks associated with the deposit product it offered to consumers and
by misrepresenting the annual percentage rate (APR) for extensions of credit it offered to
other consumers.

The Bureau’s complaint, filed in the United States District Court for the Southern District of
Florida, alleges that since 2017, Driver Loan purports to have offered short-term, high-
interest personal loans totaling over $30 million, typically to drivers who work with ride-
share companies. The loans range from $100 to $500 each and are repayable in 15 daily
installments. The Bureau alleges that Driver Loan deceptively markets its loans as having an
APR of 440% when the actual APRs are about 975%.

In 2020, Driver Loan began taking deposits from consumers to fund the loans it makes.
Driver Loan claims to guarantee a 15% annual percentage yield on consumers’ deposits. It
also claims to guarantee that consumers’ deposits are held at FDIC-insured institutions,
which would protect against the loss of insured deposits. Driver Loan’s website also
represents that a new consumer deposits funds with the company about every minute. The
Bureau alleges that Driver Loan’s representations are false, as many consumers’ funds were
not held in FDIC-insured accounts, the rate of return was not “guaranteed,” and other
consumers were not rushing to deposit their funds with Driver Loan. The Bureau also
alleges that most deposited funds are lent to borrowers at rates that violate Florida’s
criminal-usury law, rendering the loans uncollectable and creating substantial risk that
Driver Loan would not be able to collect delinquent loans or meet its obligations to
consumers who sought to withdraw their deposited funds.

The Bureau seeks an injunction against Driver Loan and Sarjeant to stop their alleged
unlawful conduct, as well as damages, redress to consumers, disgorgement of ill-gotten
gains, and the imposition of civil money penalties.

The Bureau's complaint is not a finding or ruling that Driver Loan, LLC or Angelo Jose
Sarjeant has violated the law.

A copy of the complaint is available here:
https://files.consumerfinance.gov/f/documents/cfpb_driver-loan-llc-angelo-jose-
sarjeant_complaint_2020-11.pdf lM (cfob.gov/documents/9282/cfpb_driver-loan-llc-angelo-
jose-sarjeant_complaint_2020-11.pdf)

 

 

tnt

The Consumer Financial Protection Bureau (CFPB) is a 21st century agency that helps
consumer finance markets work by making rules more effective, by consistently and fairly
enforcing those rules, and by empowering consumers to take more control over their
economic lives. For more information, visit www.consumerfinance.gov.

 

 

PRESS INFORMATION
If you want to republish the article or have questions about the content, please contact the
press office.

Go to press resources page (cfpb.gov/about-us/newsroom/press-resources/)

 

An official website of the
United States government
",--ERROR--,"nov 05, 2020","consumer financial protection bureau files lawsuit against driver loan, llc and its ceo.","washington, d.c. - the consumer financial protection bureau (bureau) today filed a lawsuit against driver loan, llc, and its chief executive officer, angelo jose sarjeant, for allegedly engaging in deceptive acts or practices in taking deposits from and offering credit to consumers. driver loan, based in doral, florida, offers short-term, high-interest loans to consumers funded by deposits made by other consumers. the bureau alleges that driver loan and sarjeant violated the consumer financial protection act of 2010 (cfpa) by misrepresenting the risks associated with the deposit product it offered to consumers and by misrepresenting the annual percentage rate (apr) for extensions of credit it offered to other consumers.
 the bureau's complaint, filed in the united states district court for the southern district of florida, alleges that since 2017, driver loan purports to have offered short-term, high- interest personal loans totaling over $30 million, typically to drivers who work with ride- share companies. the loans range from $100 to $500 each and are repayable in 15 daily installments. the bureau alleges that driver loan deceptively markets its loans as having an apr of 440% when the actual aprs are about 975%.
 in 2020, driver loan began taking deposits from consumers to fund the loans it makes.
 driver loan claims to guarantee a 15% annual percentage yield on consumers' deposits. it also claims to guarantee that consumers' deposits are held at fdic-insured institutions, which would protect against the loss of insured deposits. driver loan's website also represents that a new consumer deposits funds with the company about every minute. the bureau alleges that driver loan's representations are false, as many consumers' funds were not held in fdic-insured accounts, the rate of return was not ""guaranteed,"" and other consumers were not rushing to deposit their funds with driver loan. the bureau also alleges that most deposited funds are lent to borrowers at rates that violate florida's criminal-usury law, rendering the loans uncollectable and creating substantial risk that driver loan would not be able to collect delinquent loans or meet its obligations to consumers who sought to withdraw their deposited funds.
 the bureau seeks an injunction against driver loan and sarjeant to stop their alleged unlawful conduct, as well as damages, redress to consumers, disgorgement of ill-gotten gains, and the imposition of civil money penalties.
 the bureau's complaint is not a finding or ruling that driver loan, llc or angelo jose sarjeant has violated the law.
 a copy of the complaint is available here: https://files.consumerfinance.gov/f/documents/cfpb_driver-loan-llc-angelo-jose- sarjeant_complaint_2020-11.pdf lm (cfob.gov/documents/9282/cfpb_driver-loan-llc-angelo- jose-sarjeant_complaint_2020-11.pdf) tnt the consumer financial protection bureau (cfpb) is a 21st century agency that helps consumer finance markets work by making rules more effective, by consistently and fairly enforcing those rules, and by empowering consumers to take more control over their economic lives. for more information, visit www.consumerfinance.gov.
 press information if you want to republish the article or have questions about the content, please contact the press office.
 go to press resources page (cfpb.gov/about-us/newsroom/press-resources/) an official website of the united states government",--ERROR--,0
peaks-trust,"cf Consumer Financial
Protection Bureau

 

Consumer Financial Protection Bureau and Multiple States Enter Into Settlement
with Owner of ITT Private Loans for Substantially Assisting ITT in Unfair Practices

SEP 15, 2020

WASHINGTON, D.C. - The Consumer Financial Protection Bureau (Bureau) today filed a
proposed stipulated judgment against PEAKS Trust 2009-1, along with Deutsche Bank
National Trust Company, Deutsche Bank Trust Company Delaware, and Deutsche Bank
Trust Company Americas, in their capacity as trustees to PEAKS Trust 2009-1 (collectively,
“PEAKS""). In its complaint, filed in the District Court for the Southern District of Indiana, the
Bureau alleged that PEAKS provided substantial assistance to ITT Educational Services, Inc.
(ITT) in engaging in unfair acts and practices in violation of the Consumer Financial
Protection Act of 2010. PEAKS owned and managed private loans for students at ITT
Technical Institute. PEAKS allegedly knew or was reckless in not knowing that many student
borrowers did not understand the terms and conditions of those loans, could not afford
them, or in some cases did not even know they had them. If entered by the court, the
proposed judgment will require PEAKS to forgive all of its outstanding loans—approximately
$330 million in debt- for about 35,000 borrowers who currently have outstanding principal
balances. Forty-seven states plus the District of Columbia have also settled with PEAKS
today.

ITT operated ITT Technical Institute until it filed for bankruptcy and ceased operations in
2016. The Bureau filed suit against ITT in February, 2014, alleging that ITT engaged in
unlawful acts and practices to push students into private student loans in a scheme to
improve the appearance of ITT’s financial statements and its standing among investors. To
this end, ITT developed two private loan programs, the Student CU Connect CUSO, LLC
(CUSO) and PEAKS loan programs. Despite knowledge that the default rate on these loans
would be high-and in fact defaults reached in excess of 94 percent and 80 percent for the
two private loan programs-ITT and its partners pressed on, issuing high cost loans to
students in order to temporarily improve ITT’s balance sheet. In the end, while ITT’s partners
were paid guarantee payments by ITT to cover much of their losses, ITT students were left
saddled with high cost loans, derogatory information on their credit reports, or both.

The Bureau's complaint against PEAKS alleged that ITT arranged for the PEAKS loans to be
serviced and collected on after ITT had induced its students to take out the loans by a
variety of unfair practices, including rushing students through financial aid appointments,
using aggressive tactics, and in some cases, gaining unauthorized access to student
accounts to sign students up for loans without permission. The Bureau alleged that PEAKS
was actively involved in servicing and managing the PEAKS loan program, including the
collection of the loans, and that PEAKS’s conduct constituted substantial assistance of ITT’s
unfair acts and practices in violation of the CFPA.

If entered by the court, the proposed stipulated judgment would require PEAKS to stop
collecting on all outstanding PEAKS loans, discharge all outstanding PEAKS loans, and ask
all consumer reporting agencies to which PEAKS furnished information to delete
information relating to PEAKS loans. The order would also require PEAKS to provide notice
to all consumers with outstanding PEAKS loans that their debt has been discharged and is
no longer owed and that PEAKS is seeking to have the relevant consumer reporting
information deleted. The total amount of loan forgiveness is currently estimated to be $330
million, for about 35,000 consumers with outstanding balances owed on their PEAKS loans.

Today’s settlement with PEAKS marks the third settlement by the Bureau related to ITT’s
private loan programs. On June 14, 2019, the Bureau announced a settlement with CUSO,
another company that had been set up to hold and manage a separate portfolio of private
loans for ITT students. Under that settlement, the CUSO was required to discharge
approximately $168 million in loans. The settlements with CUSO and PEAKS combined
provide nearly $500 million in private student-loan debt-relief to former ITT students and
permanently put an end to the collection of the loans originated under these two private
loan programs established by ITT.
Additional information about the CUSO settlement can be found at:
https://www.consumerfinance.gov/about-us/newsroom/bureau-settles-student-cu-connect-
cuso-over-itt-private-loan-program/ (cfpb.gov/about-us/newsroom/bureau-settles-student-
cu-connect-cuso-over-itt-private-loan-program/)

 

 

In addition, on August 12, 2019, the Bureau announced a settlement in its lawsuit against
ITT Educational Services, which included a judgment against ITT for $60 million and an
injunction prohibiting ITT from offering or providing student loans in the future. Information
about the Bureau's settlement with ITT can be found at:
https://www.consumerfinance.gov/about-us/newsroom/bureau-settles-lawsuit-against-itt-

 

ational-services/)

The CFPB complaint against PEAKS is available at:
https://files.consumerfinance.gov/f/documents/cfpb_peaks-trust_complaint_2020-09.pdf@
(cfpb.gov/documents/9188/cfob_peaks-trust_complaint_2020-09.pdf)

 

The CFPB proposed stipulated judgment against PEAKS is available at:
https://files.consumerfinance.gov/f/documents/cfpb_peaks-trust_proposed-stipulated-
judgment_2020-09.pdf Wl (cfob.gov/documents/9189/cfob_peaks-trust_proposed-stipulate
d-judgment_2020-09.pdf)

 

 

tHE

The Consumer Financial Protection Bureau (CFPB) is a 21st century agency that helps
consumer finance markets work by making rules more effective, by consistently and fairly
enforcing those rules, and by empowering consumers to take more control over their
economic lives. For more information, visit www.consumerfinance.gov.

 

 

PRESS INFORMATION

If you want to republish the article or have questions about the content, please contact the
press office.

Go to press resources page (cfpb.gov/about-us/newsroom/press-resources/)

 

An official website of the
United States government
",--ERROR--,"sep 15, 2020",consumer financial protection bureau and multiple states enter into settlement with owner of itt private loans for substantially assisting itt in unfair practices.,"washington, d.c. - the consumer financial protection bureau (bureau) today filed a proposed stipulated judgment against peaks trust 2009-1, along with deutsche bank national trust company, deutsche bank trust company delaware, and deutsche bank trust company americas, in their capacity as trustees to peaks trust 2009-1 (collectively, ""peaks""). in its complaint, filed in the district court for the southern district of indiana, the bureau alleged that peaks provided substantial assistance to itt educational services, inc.
 (itt) in engaging in unfair acts and practices in violation of the consumer financial protection act of 2010. peaks owned and managed private loans for students at itt technical institute. peaks allegedly knew or was reckless in not knowing that many student borrowers did not understand the terms and conditions of those loans, could not afford them, or in some cases did not even know they had them. if entered by the court, the proposed judgment will require peaks to forgive all of its outstanding loansapproximately $330 million in debt- for about 35,000 borrowers who currently have outstanding principal balances. forty-seven states plus the district of columbia have also settled with peaks today.
 itt operated itt technical institute until it filed for bankruptcy and ceased operations in 2016. the bureau filed suit against itt in february, 2014, alleging that itt engaged in unlawful acts and practices to push students into private student loans in a scheme to improve the appearance of itt's financial statements and its standing among investors. to this end, itt developed two private loan programs, the student cu connect cuso, llc (cuso) and peaks loan programs. despite knowledge that the default rate on these loans would be high-and in fact defaults reached in excess of 94 percent and 80 percent for the two private loan programs-itt and its partners pressed on, issuing high cost loans to students in order to temporarily improve itt's balance sheet. in the end, while itt's partners were paid guarantee payments by itt to cover much of their losses, itt students were left saddled with high cost loans, derogatory information on their credit reports, or both.
 the bureau's complaint against peaks alleged that itt arranged for the peaks loans to be serviced and collected on after itt had induced its students to take out the loans by a variety of unfair practices, including rushing students through financial aid appointments, using aggressive tactics, and in some cases, gaining unauthorized access to student accounts to sign students up for loans without permission. the bureau alleged that peaks was actively involved in servicing and managing the peaks loan program, including the collection of the loans, and that peaks's conduct constituted substantial assistance of itt's unfair acts and practices in violation of the cfpa.
 if entered by the court, the proposed stipulated judgment would require peaks to stop collecting on all outstanding peaks loans, discharge all outstanding peaks loans, and ask all consumer reporting agencies to which peaks furnished information to delete information relating to peaks loans. the order would also require peaks to provide notice to all consumers with outstanding peaks loans that their debt has been discharged and is no longer owed and that peaks is seeking to have the relevant consumer reporting information deleted. the total amount of loan forgiveness is currently estimated to be $330 million, for about 35,000 consumers with outstanding balances owed on their peaks loans.
 today's settlement with peaks marks the third settlement by the bureau related to itt's private loan programs. on june 14, 2019, the bureau announced a settlement with cuso, another company that had been set up to hold and manage a separate portfolio of private loans for itt students. under that settlement, the cuso was required to discharge approximately $168 million in loans. the settlements with cuso and peaks combined provide nearly $500 million in private student-loan debt-relief to former itt students and permanently put an end to the collection of the loans originated under these two private loan programs established by itt.
 additional information about the cuso settlement can be found at: https://www.consumerfinance.gov/about-us/newsroom/bureau-settles-student-cu-connect- cuso-over-itt-private-loan-program/ (cfpb.gov/about-us/newsroom/bureau-settles-student- cu-connect-cuso-over-itt-private-loan-program/) in addition, on august 12, 2019, the bureau announced a settlement in its lawsuit against itt educational services, which included a judgment against itt for $60 million and an injunction prohibiting itt from offering or providing student loans in the future. information about the bureau's settlement with itt can be found at: https://www.consumerfinance.gov/about-us/newsroom/bureau-settles-lawsuit-against-itt- ational-services/) the cfpb complaint against peaks is available at: https://files.consumerfinance.gov/f/documents/cfpb_peaks-trust_complaint_2020-09.pdf@ (cfpb.gov/documents/9188/cfob_peaks-trust_complaint_2020-09.pdf) the cfpb proposed stipulated judgment against peaks is available at: https://files.consumerfinance.gov/f/documents/cfpb_peaks-trust_proposed-stipulated- judgment_2020-09.pdf wl (cfob.gov/documents/9189/cfob_peaks-trust_proposed-stipulate d-judgment_2020-09.pdf) the the consumer financial protection bureau (cfpb) is a 21st century agency that helps consumer finance markets work by making rules more effective, by consistently and fairly enforcing those rules, and by empowering consumers to take more control over their economic lives. for more information, visit www.consumerfinance.gov.
 press information if you want to republish the article or have questions about the content, please contact the press office.
 go to press resources page (cfpb.gov/about-us/newsroom/press-resources/) an official website of the united states government",--ERROR--,0
