folder,press_release_text,dd_id,dd_date,dd_h1,dd_article,dd_end,dd_error
7946-19,"Release Number 7946-19
June 25, 2019

CFTC Orders Merrill Lynch Commodities, Inc. to Pay Approximately $25 Million for
Spoofing, Manipulation, and Attempted Manipulation in Precious Metals Futures

Washington, DC - The Commodity Futures Trading Commission (CFTC) today issued an Order filing and simultaneously
settling charges against Merrill Lynch Commodities, Inc. (MLCI), a provisionally registered swap dealer, for spoofing,
manipulation, and attempted manipulation over a six-year period with respect to certain precious metals futures
contracts traded on the Commodity Exchange, Inc. (COMEX).

The CFTC Order imposes monetary sanctions totaling approximately $25 million, which includes a civil monetary penalty
of $11.5 million dollars, over $2.3 million in restitution, and disgorgement of $11.1 million. The Order also requires MLCI
to cooperate with the CFTC in matters related to this action and the underlying conduct, and to comply with certain
obligations in connection with its corporate compliance program and reporting requirements.

CFTC’s Director of Enforcement Comments

James McDonald, CFTC Director of Enforcement, stated: “Today’s enforcement action shows that the Commission
continues to aggressively pursue those who manipulate and spoof in our markets. If left unchecked, this sort of
misconduct can undermine the integrity of the price discovery process, harm law-abiding market participants, and
diminish confidence in our markets more generally. That’s why we will continue to keep our markets free from spoofing
and manipulation.”

The Order specifically finds that during the period from at least 2008 through 2014 certain traders at MLCI (Traders)
placed orders to buy and sell precious metals futures contracts with the intent to cancel the orders before execution.
According to the Order, the Traders’ spoofing strategy frequently involved placing a relatively small bid or offer with the
intent to execute that order (the Genuine Order) and, prior to the execution of the Genuine Order, placing a larger order
(or multiple orders) on the opposite side of the same market with the intent to cancel the order or orders before
execution (the Spoof Order). Generally, the Traders would receive a partial or complete fill of the Genuine Order and
cancel the Spoof Order before it was filled. The Order further finds that the Traders engaged in this conduct with the
intent to manipulate market prices and ultimately did cause artificial prices. Moreover, as the Order finds, on occasion,
certain Traders acknowledged spoofing to affect prices. For example, in a November 16, 2010 electronic chat, a Trader
stated:

“guys the algos are really geared up in here. [I]f you spoof this it really moves... .”
The Order recognizes that MLCI provided substantial cooperation to CFTC’s Division of Enforcement which resulted in a
substantially reduced civil monetary penalty.

Today, the US Department of Justice also announced that the Fraud Section of the Criminal Division has entered into a
Non-Prosecution Agreement with MLCI in a parallel matter. Under the terms of the agreement, MLCI has agreed, among
other things, to pay $25 million, which represents the combined appropriate criminal fine, forfeiture, and restitution
amounts in that matter, to cooperate fully with the Fraud Section in any and all matters relating to the underlying
conduct, and to comply with certain obligations in connection with its corporate compliance program and reporting
requirements.

The CFTC thanks and acknowledges the assistance of the U.S. Department of Justice and the Federal Bureau of
Investigation.

This case is brought in connection with the CFTC Division of Enforcement’s Spoofing Task Force, and the staff members
responsible for this matter are Brandon Wozniak, Lara Turcik, Candice Aloisi, Lenel Hickson, Jr., and Manal M. Sultan.
","Release Number 7946-19 June 25, 2019",today,"CFTC Orders Merrill Lynch Commodities, Inc. to Pay Approximately $25 Million for Spoofing, Manipulation, and Attempted Manipulation in Precious Metals Futures. The CFTC Order imposes monetary sanctions totaling approximately $25 million, which includes a civil monetary penalty of $11.5 million dollars, over $2.3 million in restitution, and disgorgement of $11.1 million. The Order also requires MLCI to cooperate with the CFTC in matters related to this action and the underlying conduct, and to comply with certain obligations in connection with its corporate compliance program and reporting requirements.. CFTC’s Director of Enforcement Comments. James McDonald, CFTC Director of Enforcement, stated: “Today’s enforcement action shows that the Commission continues to aggressively pursue those who manipulate and spoof in our markets. If left unchecked, this sort of misconduct can undermine the integrity of the price discovery process, harm law-abiding market participants, and diminish confidence in our markets more generally. That’s why we will continue to keep our markets free from spoofing and manipulation.”. The Order specifically finds that during the period from at least 2008 through 2014 certain traders at MLCI (Traders) placed orders to buy and sell precious metals futures contracts with the intent to cancel the orders before execution.. According to the Order, the Traders’ spoofing strategy frequently involved placing a relatively small bid or offer with the intent to execute that order (the Genuine Order) and, prior to the execution of the Genuine Order, placing a larger order (or multiple orders) on the opposite side of the same market with the intent to cancel the order or orders before execution (the Spoof Order). Generally, the Traders would receive a partial or complete fill of the Genuine Order and cancel the Spoof Order before it was filled. The Order further finds that the Traders engaged in this conduct with the intent to manipulate market prices and ultimately did cause artificial prices. Moreover, as the Order finds, on occasion, certain Traders acknowledged spoofing to affect prices. For example, in a November 16, 2010 electronic chat, a Trader stated:. “guys the algos are really geared up in here. [I]f you spoof this it really moves... .” The Order recognizes that MLCI provided substantial cooperation to CFTC’s Division of Enforcement which resulted in a substantially reduced civil monetary penalty.. Today, the US Department of Justice also announced that the Fraud Section of the Criminal Division has entered into a Non-Prosecution Agreement with MLCI in a parallel matter. Under the terms of the agreement, MLCI has agreed, among other things, to pay $25 million, which represents the combined appropriate criminal fine, forfeiture, and restitution amounts in that matter, to cooperate fully with the Fraud Section in any and all matters relating to the underlying conduct, and to comply with certain obligations in connection with its corporate compliance program and reporting requirements.. The CFTC thanks and acknowledges the assistance of the U.S. Department of Justice and the Federal Bureau of Investigation.. This case is brought in connection with the CFTC Division of Enforcement’s Spoofing Task Force, and the staff members responsible for this matter are Brandon Wozniak, Lara Turcik, Candice Aloisi, Lenel Hickson, Jr., and Manal M. Sultan.","Release Number 7946-19 June 25, 2019
CFTC Orders Merrill Lynch Commodities, Inc. to Pay Approximately $25 Million for Spoofing, Manipulation, and Attempted Manipulation in Precious Metals Futures
Washington, DC - The Commodity Futures Trading Commission (CFTC) today issued an Order filing and simultaneously settling charges against Merrill Lynch Commodities, Inc. (MLCI), a provisionally registered swap dealer, for spoofing, manipulation, and attempted manipulation over a six-year period with respect to certain precious metals futures contracts traded on the Commodity Exchange, Inc. (COMEX).

The CFTC Order imposes monetary sanctions totaling approximately $25 million, which includes a civil monetary penalty of $11.5 million dollars, over $2.3 million in restitution, and disgorgement of $11.1 million. The Order also requires MLCI to cooperate with the CFTC in matters related to this action and the underlying conduct, and to comply with certain obligations in connection with its corporate compliance program and reporting requirements.

CFTC’s Director of Enforcement Comments
James McDonald, CFTC Director of Enforcement, stated: “Today’s enforcement action shows that the Commission continues to aggressively pursue those who manipulate and spoof in our markets. If left unchecked, this sort of misconduct can undermine the integrity of the price discovery process, harm law-abiding market participants, and diminish confidence in our markets more generally. That’s why we will continue to keep our markets free from spoofing and manipulation.”
The Order specifically finds that during the period from at least 2008 through 2014 certain traders at MLCI (Traders) placed orders to buy and sell precious metals futures contracts with the intent to cancel the orders before execution.
According to the Order, the Traders’ spoofing strategy frequently involved placing a relatively small bid or offer with the intent to execute that order (the Genuine Order) and, prior to the execution of the Genuine Order, placing a larger order (or multiple orders) on the opposite side of the same market with the intent to cancel the order or orders before execution (the Spoof Order). Generally, the Traders would receive a partial or complete fill of the Genuine Order and cancel the Spoof Order before it was filled. The Order further finds that the Traders engaged in this conduct with the intent to manipulate market prices and ultimately did cause artificial prices. Moreover, as the Order finds, on occasion, certain Traders acknowledged spoofing to affect prices. For example, in a November 16, 2010 electronic chat, a Trader stated:
“guys the algos are really geared up in here. [I]f you spoof this it really moves... .” The Order recognizes that MLCI provided substantial cooperation to CFTC’s Division of Enforcement which resulted in a substantially reduced civil monetary penalty.

Today, the US Department of Justice also announced that the Fraud Section of the Criminal Division has entered into a Non-Prosecution Agreement with MLCI in a parallel matter. Under the terms of the agreement, MLCI has agreed, among other things, to pay $25 million, which represents the combined appropriate criminal fine, forfeiture, and restitution amounts in that matter, to cooperate fully with the Fraud Section in any and all matters relating to the underlying conduct, and to comply with certain obligations in connection with its corporate compliance program and reporting requirements.","The CFTC thanks and acknowledges the assistance of the U.S. Department of Justice and the Federal Bureau of Investigation.

This case is brought in connection with the CFTC Division of Enforcement’s Spoofing Task Force, and the staff members responsible for this matter are Brandon Wozniak, Lara Turcik, Candice Aloisi, Lenel Hickson, Jr., and Manal M. Sultan.",0
7721-18,"Release Number 7721-18
April 30, 2018

CFTC Orders Glencore Agriculture B.V. and Glencore Ltd. to Pay a $2 Million Penalty for
Exceeding Cotton Futures Position Limits, Transacting Illegal EFPs, and Submitting
Inaccurate Form 304s

Cotton Trading by Glencore Agriculture B.V. and Glencore Ltd. Was under Common Control
by Head of Glencore Cotton Trading

Washington, DC - The Commodity Futures Trading Commission (CFTC) today issued an order filing and settling charges
against Glencore Agriculture B.V., f/k/a Glencore Grain B.V. (Glencore B.V.), located in Rotterdam, the
Netherlands, and Glencore Ltd., located in Stamford, Connecticut, finding that on multiple trading days during May
2013, June 2013, May 2014, and June 2014, Glencore B.V. and Glencore Ltd. held net positions in the ICE Futures Cotton
No. 2 contracts (cotton futures) that, on an aggregated basis, exceeded the speculative position limits established by the
CFTC. In addition, the CFTC Order finds that on twenty-four occasions between January 2013 and November 2015,
Glencore B.V. and Glencore Ltd. executed exchange of futures for physical transactions (EFPs) opposite each other’s
cotton futures trading accounts, even though their accounts were not independently controlled as required for such
transactions not to constitute illegal wash trades. And, on at least two occasions in 2013 and 2014, Glencore B.V.
submitted to the CFTC a Form 304 that failed to represent accurately all required information, including its short cash
sales commitments, according to the CFTC Order.

The CFTC Order requires Glencore B.V. and Glencore Ltd., jointly and severally, to pay a $2 million civil monetary penalty
and to cease and desist from further violations of the Commodity Exchange Act (CEA) and CFTC Regulations, as charged.

According to the CFTC Order, at all times relevant to the Order, Glencore centralized the management of its global cotton
business under the direction of a single trading manager (referred to in the Order as Head of Cotton), who oversaw
cotton operations across all Glencore entities. The Head of Cotton directly supervised cotton traders at Glencore B.V. and
was also the direct supervisor of Glencore Ltd.’s head cotton trader.

The CEA and CFTC Regulations set limits on the net long or net short position that any person may hold or control for
certain commodities, including a limit of 5,000 cotton futures for a single month, other than the spot month, exclusive of
bona fide hedging transactions. The CFTC Order finds that because Glencore B.V. and Glencore Ltd. operated their
cotton trading under the common control of Glencore’s Head of Cotton, their cotton futures positions should have been
aggregated for purposes of complying with the Commission’s position limits. When aggregated, the cotton futures
positions of Glencore B.V. and Glencore Ltd. exceeded 5,000 net contracts, exclusive of bona fide hedging transactions,
on multiple days during May 2013, June 2013, May 2014, and June 2014.

The CEA and CFTC Regulations permit noncompetitive trading, such as EFPs, only if such transactions are conducted in
accordance with rules of an exchange, such as the Intercontinental Exchange (ICE), that are approved by the CFTC. At all
times relevant to this Order, ICE rules permitted the transaction of EFPs between independently controlled accounts.
However, the CFTC Order finds that Glencore B.V.’s and Glencore Ltd.’s cotton futures trading accounts were both
ultimately controlled by Glencore’s Head of Cotton. As a result they were not independently controlled. Nevertheless,
between January 2013 and November 2015, Glencore B.V. and Glencore Ltd. executed twenty-four EFPs opposite one
another’s accounts, according to the CFTC Order.

The Order further states that CFTC Regulations require cotton merchants and dealers holding or controlling reportable
futures positions to file a monthly Statement of Cash Positions in Cotton (Form 304), as of the close of business on the
last Friday of the month. On the Form 304, entities report the composition of their fixed price cash position in cotton and
cotton products, including the quantity of open fixed price purchase and fixed price sale commitments. The CFTC Order
finds that Glencore B.V. filed two erroneous Form 304 reports with the CFTC—one on May 31, 2013 and a second on May
30, 2014—that overstated the quantities of its fixed price cotton cash positions.

The CFTC thanks and acknowledges the Dutch Authority for the Financial Markets for its assistance in this matter.

CFTC Division of Enforcement staff members responsible for this action are James Deacon, Ilana Waxman, Laura
Brookover, Kara Mucha, John Buffington, James H. Holl, Ill, and Rick Glaser. The Division of Enforcement would like to
recognize the assistance of other CFTC staff: Janet Briner, Kelly Beck, Harry Hild, and Matthew Hunter.
","Release Number 7721-18 April 30, 2018",today,"CFTC Orders Glencore Agriculture B.V. and Glencore Ltd. to Pay a $2 Million Penalty for Exceeding Cotton Futures Position Limits, Transacting Illegal EFPs, and Submitting Inaccurate Form 304s. Cotton Trading by Glencore Agriculture B.V. and Glencore Ltd. Was under Common Control by Head of Glencore Cotton Trading. submitted to the CFTC a Form 304 that failed to represent accurately all required information, including its short cash sales commitments, according to the CFTC Order.. The CFTC Order requires Glencore B.V. and Glencore Ltd., jointly and severally, to pay a $2 million civil monetary penalty and to cease and desist from further violations of the Commodity Exchange Act (CEA) and CFTC Regulations, as charged.. According to the CFTC Order, at all times relevant to the Order, Glencore centralized the management of its global cotton business under the direction of a single trading manager (referred to in the Order as Head of Cotton), who oversaw cotton operations across all Glencore entities. The Head of Cotton directly supervised cotton traders at Glencore B.V. and was also the direct supervisor of Glencore Ltd.’s head cotton trader.. The CEA and CFTC Regulations set limits on the net long or net short position that any person may hold or control for certain commodities, including a limit of 5,000 cotton futures for a single month, other than the spot month, exclusive of bona fide hedging transactions. The CFTC Order finds that because Glencore B.V. and Glencore Ltd. operated their cotton trading under the common control of Glencore’s Head of Cotton, their cotton futures positions should have been aggregated for purposes of complying with the Commission’s position limits. When aggregated, the cotton futures positions of Glencore B.V. and Glencore Ltd. exceeded 5,000 net contracts, exclusive of bona fide hedging transactions, on multiple days during May 2013, June 2013, May 2014, and June 2014.. The CEA and CFTC Regulations permit noncompetitive trading, such as EFPs, only if such transactions are conducted in accordance with rules of an exchange, such as the Intercontinental Exchange (ICE), that are approved by the CFTC. At all times relevant to this Order, ICE rules permitted the transaction of EFPs between independently controlled accounts.. However, the CFTC Order finds that Glencore B.V.’s and Glencore Ltd.’s cotton futures trading accounts were both ultimately controlled by Glencore’s Head of Cotton. As a result they were not independently controlled. Nevertheless, between January 2013 and November 2015, Glencore B.V. and Glencore Ltd. executed twenty-four EFPs opposite one another’s accounts, according to the CFTC Order.. The Order further states that CFTC Regulations require cotton merchants and dealers holding or controlling reportable futures positions to file a monthly Statement of Cash Positions in Cotton (Form 304), as of the close of business on the last Friday of the month. On the Form 304, entities report the composition of their fixed price cash position in cotton and cotton products, including the quantity of open fixed price purchase and fixed price sale commitments. The CFTC Order finds that Glencore B.V. filed two erroneous Form 304 reports with the CFTC—one on May 31, 2013 and a second on May 30, 2014—that overstated the quantities of its fixed price cotton cash positions.. The CFTC thanks and acknowledges the Dutch Authority for the Financial Markets for its assistance in this matter.. CFTC Division of Enforcement staff members responsible for this action are James Deacon, Ilana Waxman, Laura Brookover, Kara Mucha, John Buffington, James H. Holl, Ill, and Rick Glaser. The Division of Enforcement would like to recognize the assistance of other CFTC staff: Janet Briner, Kelly Beck, Harry Hild, and Matthew Hunter.","Release Number 7721-18 April 30, 2018
CFTC Orders Glencore Agriculture B.V. and Glencore Ltd. to Pay a $2 Million Penalty for Exceeding Cotton Futures Position Limits, Transacting Illegal EFPs, and Submitting Inaccurate Form 304s
Cotton Trading by Glencore Agriculture B.V. and Glencore Ltd. Was under Common Control by Head of Glencore Cotton Trading
Washington, DC - The Commodity Futures Trading Commission (CFTC) today issued an order filing and settling charges against Glencore Agriculture B.V., f/k/a Glencore Grain B.V. (Glencore B.V.), located in Rotterdam, the Netherlands, and Glencore Ltd., located in Stamford, Connecticut, finding that on multiple trading days during May 2013, June 2013, May 2014, and June 2014, Glencore B.V. and Glencore Ltd. held net positions in the ICE Futures Cotton No. 2 contracts (cotton futures) that, on an aggregated basis, exceeded the speculative position limits established by the CFTC. In addition, the CFTC Order finds that on twenty-four occasions between January 2013 and November 2015, Glencore B.V. and Glencore Ltd. executed exchange of futures for physical transactions (EFPs) opposite each other’s cotton futures trading accounts, even though their accounts were not independently controlled as required for such transactions not to constitute illegal wash trades. And, on at least two occasions in 2013 and 2014, Glencore B.V.
submitted to the CFTC a Form 304 that failed to represent accurately all required information, including its short cash sales commitments, according to the CFTC Order.

The CFTC Order requires Glencore B.V. and Glencore Ltd., jointly and severally, to pay a $2 million civil monetary penalty and to cease and desist from further violations of the Commodity Exchange Act (CEA) and CFTC Regulations, as charged.

According to the CFTC Order, at all times relevant to the Order, Glencore centralized the management of its global cotton business under the direction of a single trading manager (referred to in the Order as Head of Cotton), who oversaw cotton operations across all Glencore entities. The Head of Cotton directly supervised cotton traders at Glencore B.V. and was also the direct supervisor of Glencore Ltd.’s head cotton trader.

The CEA and CFTC Regulations set limits on the net long or net short position that any person may hold or control for certain commodities, including a limit of 5,000 cotton futures for a single month, other than the spot month, exclusive of bona fide hedging transactions. The CFTC Order finds that because Glencore B.V. and Glencore Ltd. operated their cotton trading under the common control of Glencore’s Head of Cotton, their cotton futures positions should have been aggregated for purposes of complying with the Commission’s position limits. When aggregated, the cotton futures positions of Glencore B.V. and Glencore Ltd. exceeded 5,000 net contracts, exclusive of bona fide hedging transactions, on multiple days during May 2013, June 2013, May 2014, and June 2014.

The CEA and CFTC Regulations permit noncompetitive trading, such as EFPs, only if such transactions are conducted in accordance with rules of an exchange, such as the Intercontinental Exchange (ICE), that are approved by the CFTC. At all times relevant to this Order, ICE rules permitted the transaction of EFPs between independently controlled accounts.
However, the CFTC Order finds that Glencore B.V.’s and Glencore Ltd.’s cotton futures trading accounts were both ultimately controlled by Glencore’s Head of Cotton. As a result they were not independently controlled. Nevertheless, between January 2013 and November 2015, Glencore B.V. and Glencore Ltd. executed twenty-four EFPs opposite one another’s accounts, according to the CFTC Order.

The Order further states that CFTC Regulations require cotton merchants and dealers holding or controlling reportable futures positions to file a monthly Statement of Cash Positions in Cotton (Form 304), as of the close of business on the last Friday of the month. On the Form 304, entities report the composition of their fixed price cash position in cotton and cotton products, including the quantity of open fixed price purchase and fixed price sale commitments. The CFTC Order finds that Glencore B.V. filed two erroneous Form 304 reports with the CFTC—one on May 31, 2013 and a second on May 30, 2014—that overstated the quantities of its fixed price cotton cash positions.","The CFTC thanks and acknowledges the Dutch Authority for the Financial Markets for its assistance in this matter.

CFTC Division of Enforcement staff members responsible for this action are James Deacon, Ilana Waxman, Laura Brookover, Kara Mucha, John Buffington, James H. Holl, Ill, and Rick Glaser. The Division of Enforcement would like to recognize the assistance of other CFTC staff: Janet Briner, Kelly Beck, Harry Hild, and Matthew Hunter.",0
