folder,press_release_text,dd_id,dd_date,dd_h1,dd_article,dd_end,dd_error
7868-19,"Release Number 7868-19
February 8, 2019

Federal Court Orders Husband and Wife Team and Their Company to Pay Defrauded
Customers More Than $1 Million in Connection with a Futures Trading Scheme

Washington, DC — The Commodity Futures Trading Commission (CFTC) announced today that on December 27, 2018 a
Washington State federal court ordered Bellevue, Washington residents Sung Hong a/k/a Lawrence Hong or
Laurence Hong, his wife, Hyun Joo Hong a/k/a/ Grace Hong, and their company Pishon Holding LLC to pay more
than $1.25 million in restitution in connection with an enforcement action brought by the CFTC charging the defendants
with fraudulent solicitation and misappropriation involving futures contracts. In addition to the restitution, the Court
Order also imposes a permanent trading and registration ban on the Hongs and Pishon and prohibits them from violating
provisions of the Commodity Exchange Act (CEA) as charged.

The Court’s Order stems from a CFTC Complaint filed on June 1, 2017 in the U.S. District Court for the Western District of
Washington. [See CFTC Press Release 7569-17]. In the Order, Judge Marsha Pechman found that the Hongs and Pishon
misappropriated $1,259,317.77 from their customers. Additionally, the court found that the Hongs and Pishon
fraudulently solicited more than $11 million dollars from customers for the purpose of trading futures contacts. The court
further found that the Hongs and Pishon lied about, about among other things how much money they had under
management; Laurence Hong’s prior trading success; and how trading fees would be deducted from customer accounts.
At the same time, the Court Order found, the Hongs and Pishon failed to tell customers that Laurence Hong had been
imprisoned previously for 33 months in connection with wire fraud charges.

In a parallel criminal case filed in the United States District Court for the Western District of Washington, Laurence Hong
and Grace Hong pleaded guilty on March 27, 2018 and March 30, 2018, respectively, to multiple criminal counts. See
Case No. CR17-163TSZ. On October 11, 2018, Laurence Hong was sentenced to a 180-month prison term and Grace
Hong was sentenced to a 72-month prison term. The court ordered that the defendants also pay restitution in the
criminal matter. In recognition of the prior restitution award in the criminal matter, Judge Pechman ordered that the
defendants may offset their civil restitution obligation with payments in the criminal matter on a one-to-one basis.

The CFTC cautions victims that restitution orders may not result in the recovery of money lost because the wrongdoers
may not have sufficient funds or assets. The CFTC will continue to fight vigorously for the protection of customers and to
ensure the wrongdoers are held accountable.

The Division of Enforcement thanks the United States Attorney for the Western District of Washington and the FBI for
their invaluable assistance and cooperation.

The CFTC Division of Enforcement staff members responsible for this case are Kevin Samuel, Ilana Waxman, Kim Bruno,
Alison Wilson, and Rick Glaser.
","Release Number 7868-19 February 8, 2019",today,"Federal Court Orders Husband and Wife Team and Their Company to Pay Defrauded Customers More Than $1 Million in Connection with a Futures Trading Scheme. The Court’s Order stems from a CFTC Complaint filed on June 1, 2017 in the U.S. District Court for the Western District of Washington. [See CFTC Press Release 7569-17]. In the Order, Judge Marsha Pechman found that the Hongs and Pishon misappropriated $1,259,317.77 from their customers. Additionally, the court found that the Hongs and Pishon fraudulently solicited more than $11 million dollars from customers for the purpose of trading futures contacts. The court further found that the Hongs and Pishon lied about, about among other things how much money they had under management; Laurence Hong’s prior trading success; and how trading fees would be deducted from customer accounts.. At the same time, the Court Order found, the Hongs and Pishon failed to tell customers that Laurence Hong had been imprisoned previously for 33 months in connection with wire fraud charges.. In a parallel criminal case filed in the United States District Court for the Western District of Washington, Laurence Hong and Grace Hong pleaded guilty on March 27, 2018 and March 30, 2018, respectively, to multiple criminal counts. See Case No. CR17-163TSZ. On October 11, 2018, Laurence Hong was sentenced to a 180-month prison term and Grace Hong was sentenced to a 72-month prison term. The court ordered that the defendants also pay restitution in the criminal matter. In recognition of the prior restitution award in the criminal matter, Judge Pechman ordered that the defendants may offset their civil restitution obligation with payments in the criminal matter on a one-to-one basis.. The CFTC cautions victims that restitution orders may not result in the recovery of money lost because the wrongdoers may not have sufficient funds or assets. The CFTC will continue to fight vigorously for the protection of customers and to ensure the wrongdoers are held accountable.. The Division of Enforcement thanks the United States Attorney for the Western District of Washington and the FBI for their invaluable assistance and cooperation.. The CFTC Division of Enforcement staff members responsible for this case are Kevin Samuel, Ilana Waxman, Kim Bruno, Alison Wilson, and Rick Glaser.","Release Number 7868-19 February 8, 2019
Federal Court Orders Husband and Wife Team and Their Company to Pay Defrauded Customers More Than $1 Million in Connection with a Futures Trading Scheme
Washington, DC — The Commodity Futures Trading Commission (CFTC) announced today that on December 27, 2018 a Washington State federal court ordered Bellevue, Washington residents Sung Hong a/k/a Lawrence Hong or Laurence Hong, his wife, Hyun Joo Hong a/k/a/ Grace Hong, and their company Pishon Holding LLC to pay more than $1.25 million in restitution in connection with an enforcement action brought by the CFTC charging the defendants with fraudulent solicitation and misappropriation involving futures contracts. In addition to the restitution, the Court Order also imposes a permanent trading and registration ban on the Hongs and Pishon and prohibits them from violating provisions of the Commodity Exchange Act (CEA) as charged.

The Court’s Order stems from a CFTC Complaint filed on June 1, 2017 in the U.S. District Court for the Western District of Washington. [See CFTC Press Release 7569-17]. In the Order, Judge Marsha Pechman found that the Hongs and Pishon misappropriated $1,259,317.77 from their customers. Additionally, the court found that the Hongs and Pishon fraudulently solicited more than $11 million dollars from customers for the purpose of trading futures contacts. The court further found that the Hongs and Pishon lied about, about among other things how much money they had under management; Laurence Hong’s prior trading success; and how trading fees would be deducted from customer accounts.
At the same time, the Court Order found, the Hongs and Pishon failed to tell customers that Laurence Hong had been imprisoned previously for 33 months in connection with wire fraud charges.

In a parallel criminal case filed in the United States District Court for the Western District of Washington, Laurence Hong and Grace Hong pleaded guilty on March 27, 2018 and March 30, 2018, respectively, to multiple criminal counts. See Case No. CR17-163TSZ. On October 11, 2018, Laurence Hong was sentenced to a 180-month prison term and Grace Hong was sentenced to a 72-month prison term. The court ordered that the defendants also pay restitution in the criminal matter. In recognition of the prior restitution award in the criminal matter, Judge Pechman ordered that the defendants may offset their civil restitution obligation with payments in the criminal matter on a one-to-one basis.

The CFTC cautions victims that restitution orders may not result in the recovery of money lost because the wrongdoers may not have sufficient funds or assets. The CFTC will continue to fight vigorously for the protection of customers and to ensure the wrongdoers are held accountable.","The Division of Enforcement thanks the United States Attorney for the Western District of Washington and the FBI for their invaluable assistance and cooperation.

The CFTC Division of Enforcement staff members responsible for this case are Kevin Samuel, Ilana Waxman, Kim Bruno, Alison Wilson, and Rick Glaser.",0
8061-19,"Release Number 8061-19
October 24, 2019

CFTC Charges New York Man with Misappropriating Customer Funds Intended for Futures
and Forex Trading

Washington, D.C. - The U.S. Commodity Futures Trading Commission today announced the filing of a civil enforcement
action in the U.S. District Court for the Southern District of New York against Eyal Alper of Tarrytown, New York, for
fraud and misappropriating funds.

The CFTC’s complaint charges Alper with defrauding members of the public by fraudulently soliciting them to trade
futures and/or forex contracts through accounts purportedly managed by Alper, and misappropriating at least $280,000
of the funds provided to him for these purposes.

According to the complaint, Alper improperly commingled the customers’ funds with his own funds, never opened trading
accounts for his customers as promised, and sent false statements to his customers reporting purported profits in the
fictitious accounts.

In its continuing litigation against Alper, the CFTC seeks restitution to defrauded customers, disgorgement of ill-gotten
gains, civil monetary penalties, permanent registration and trading bans, and a permanent injunction against future
violations of federal commodities laws, as charged.

The CFTC thanks and acknowledges the assistance of the U.K. Financial Conduct Authority.
The Division of Enforcement staff members responsible for this case are Alan Edelman, Kara Mucha, Daniel Jordan, and
Rick Glaser.

OK OK OK OK KK

CFTC’s Foreign Currency (Forex) Fraud Advisory

The CFTC has issued several customer protection Fraud Advisories that provide the warning signs of fraud, including the
Foreign Currency Trading (Forex) Fraud Advisory, which states that the CFTC has witnessed a sharp rise in Forex trading
scams in recent years and helps customers identify this potential fraud.

-CFTC-
",-1,2019,"CFTC Charges New York Man with Misappropriating Customer Funds Intended for Futures and Forex Trading. Washington, D.C. - The U.S. Commodity Futures Trading Commission today announced the filing of a civil enforcement action in the U.S. District Court for the Southern District of New York against Eyal Alper of Tarrytown, New York, for fraud and misappropriating funds.. The CFTC’s complaint charges Alper with defrauding members of the public by fraudulently soliciting them to trade futures and/or forex contracts through accounts purportedly managed by Alper, and misappropriating at least $280,000 of the funds provided to him for these purposes.. According to the complaint, Alper improperly commingled the customers’ funds with his own funds, never opened trading accounts for his customers as promised, and sent false statements to his customers reporting purported profits in the fictitious accounts.. In its continuing litigation against Alper, the CFTC seeks restitution to defrauded customers, disgorgement of ill-gotten gains, civil monetary penalties, permanent registration and trading bans, and a permanent injunction against future violations of federal commodities laws, as charged.. The CFTC thanks and acknowledges the assistance of the U.K. Financial Conduct Authority.. The Division of Enforcement staff members responsible for this case are Alan Edelman, Kara Mucha, Daniel Jordan, and Rick Glaser.. OK OK OK OK KK. CFTC’s Foreign Currency (Forex) Fraud Advisory. The CFTC has issued several customer protection Fraud Advisories that provide the warning signs of fraud, including the Foreign Currency Trading (Forex) Fraud Advisory, which states that the CFTC has witnessed a sharp rise in Forex trading scams in recent years and helps customers identify this potential fraud.","Release Number 8061-19 October 24, 2019
CFTC Charges New York Man with Misappropriating Customer Funds Intended for Futures and Forex Trading
Washington, D.C. - The U.S. Commodity Futures Trading Commission today announced the filing of a civil enforcement action in the U.S. District Court for the Southern District of New York against Eyal Alper of Tarrytown, New York, for fraud and misappropriating funds.

The CFTC’s complaint charges Alper with defrauding members of the public by fraudulently soliciting them to trade futures and/or forex contracts through accounts purportedly managed by Alper, and misappropriating at least $280,000 of the funds provided to him for these purposes.

According to the complaint, Alper improperly commingled the customers’ funds with his own funds, never opened trading accounts for his customers as promised, and sent false statements to his customers reporting purported profits in the fictitious accounts.

In its continuing litigation against Alper, the CFTC seeks restitution to defrauded customers, disgorgement of ill-gotten gains, civil monetary penalties, permanent registration and trading bans, and a permanent injunction against future violations of federal commodities laws, as charged.

The CFTC thanks and acknowledges the assistance of the U.K. Financial Conduct Authority.
The Division of Enforcement staff members responsible for this case are Alan Edelman, Kara Mucha, Daniel Jordan, and Rick Glaser.","OK OK OK OK KK
CFTC’s Foreign Currency (Forex) Fraud Advisory
The CFTC has issued several customer protection Fraud Advisories that provide the warning signs of fraud, including the Foreign Currency Trading (Forex) Fraud Advisory, which states that the CFTC has witnessed a sharp rise in Forex trading scams in recent years and helps customers identify this potential fraud.

-CFTC-",0
8232-20,"Release Number 8232-20
CFTC Charges 10 Commodity Trading Advisors for Failing to Maintain NFA Memberships

September 03, 2020

Washington, D.C. — The Commodity Futures Trading Commission today announced the filing of charges against 10
commodity trading advisors (CTAs) for failing to obtain and maintain membership in a registered futures association
(RFA) as required by CFTC regulations. Compliance with this provision necessarily requires all registered CTAs to maintain
membership in the National Futures Association (NFA), which is the only RFA currently registered with the CFTC.

The 10 respondents named in the CFTC’s complaints are: Adale LLC, a California limited liability corporation; Amgad
Gayed Attia, a New York resident; Obie Lee Cole, an lowa resident; CWE USA LLC, a California limited liability
corporation; Suanne Fay Goldman, an Illinois resident; Griggs Research & Consulting Inc., an Indiana corporation;
JPR Inc., a Maryland corporation; Lewis Futures Management LLC, a Georgia limited liability corporation; McClelland
Capital Management Inc., a New York corporation; and Weiliang Shao, a Nevada resident.

“As the sole registered futures association, NFA plays a critical role in the oversight of CFTC registrants,” said Division of
Enforcement Director James McDonald. “But NFA can only do its part if registrants submit to its jurisdictional
requirements. Where registrants seek to skirt those rules, the CFTC will act to ensure compliance and to preserve NFA’s
ability to carry out its important oversight function. Our derivatives markets are better served, and the public is better
protected, by these important requirements.”

Case Background

The complaints charge that the respondents, though registered as CTAs, are violating CFTC Regulation 170.17, which
requires that every registered CTA, unless eligible for certain exemptions, must become and remain a member of at least
one RFA.

By failing to maintain membership with the NFA or assert a valid exemption from NFA membership, the respondents have
improperly avoided NFA’s industry self-regulation. The NFA is responsible, with CFTC oversight, for certain aspects of the
regulation of CTAs and other futures entities, including examining CTAs’ qualifications and proficiency, financial
condition, retail sales practices, and business conduct. Because the respondents have not maintained their membership
with NFA, it has had no jurisdiction to perform its vital self-regulatory functions with respect to the respondents.

In its enforcement action, the CFTC seeks an order directing the respondents to cease and desist from violating the
provision requiring membership in an RFA.

The CFTC thanks NFA for its cooperation and assistance.

The Division of Enforcement staff members responsible for this action are Douglas Snodgrass, Elizabeth N. Pendleton, Scott R.
Williamson, Joan Manley, and Robert T. Howell.

-CFTC-
",Release Number 8232-20 CFTC Charges 10 Commodity Trading Advisors for Failing to Maintain NFA Memberships,"September 03, 2020","Washington, D.C. — The Commodity Futures Trading Commission today announced the filing of charges against 10 commodity trading advisors (CTAs) for failing to obtain and maintain membership in a registered futures association (RFA) as required by CFTC regulations. Compliance with this provision necessarily requires all registered CTAs to maintain membership in the National Futures Association (NFA), which is the only RFA currently registered with the CFTC.. The 10 respondents named in the CFTC’s complaints are: Adale LLC, a California limited liability corporation; Amgad Gayed Attia, a New York resident; Obie Lee Cole, an lowa resident; CWE USA LLC, a California limited liability corporation; Suanne Fay Goldman, an Illinois resident; Griggs Research & Consulting Inc., an Indiana corporation; JPR Inc., a Maryland corporation; Lewis Futures Management LLC, a Georgia limited liability corporation; McClelland Capital Management Inc., a New York corporation; and Weiliang Shao, a Nevada resident.. “As the sole registered futures association, NFA plays a critical role in the oversight of CFTC registrants,” said Division of Enforcement Director James McDonald. “But NFA can only do its part if registrants submit to its jurisdictional requirements. Where registrants seek to skirt those rules, the CFTC will act to ensure compliance and to preserve NFA’s ability to carry out its important oversight function. Our derivatives markets are better served, and the public is better protected, by these important requirements.”. Case Background. The complaints charge that the respondents, though registered as CTAs, are violating CFTC Regulation 170.17, which requires that every registered CTA, unless eligible for certain exemptions, must become and remain a member of at least one RFA.. By failing to maintain membership with the NFA or assert a valid exemption from NFA membership, the respondents have improperly avoided NFA’s industry self-regulation. The NFA is responsible, with CFTC oversight, for certain aspects of the regulation of CTAs and other futures entities, including examining CTAs’ qualifications and proficiency, financial condition, retail sales practices, and business conduct. Because the respondents have not maintained their membership with NFA, it has had no jurisdiction to perform its vital self-regulatory functions with respect to the respondents.. In its enforcement action, the CFTC seeks an order directing the respondents to cease and desist from violating the provision requiring membership in an RFA.. The CFTC thanks NFA for its cooperation and assistance.. The Division of Enforcement staff members responsible for this action are Douglas Snodgrass, Elizabeth N. Pendleton, Scott R.. Williamson, Joan Manley, and Robert T. Howell.","Release Number 8232-20 CFTC Charges 10 Commodity Trading Advisors for Failing to Maintain NFA Memberships
September 03, 2020
Washington, D.C. — The Commodity Futures Trading Commission today announced the filing of charges against 10 commodity trading advisors (CTAs) for failing to obtain and maintain membership in a registered futures association (RFA) as required by CFTC regulations. Compliance with this provision necessarily requires all registered CTAs to maintain membership in the National Futures Association (NFA), which is the only RFA currently registered with the CFTC.

The 10 respondents named in the CFTC’s complaints are: Adale LLC, a California limited liability corporation; Amgad Gayed Attia, a New York resident; Obie Lee Cole, an lowa resident; CWE USA LLC, a California limited liability corporation; Suanne Fay Goldman, an Illinois resident; Griggs Research & Consulting Inc., an Indiana corporation; JPR Inc., a Maryland corporation; Lewis Futures Management LLC, a Georgia limited liability corporation; McClelland Capital Management Inc., a New York corporation; and Weiliang Shao, a Nevada resident.

“As the sole registered futures association, NFA plays a critical role in the oversight of CFTC registrants,” said Division of Enforcement Director James McDonald. “But NFA can only do its part if registrants submit to its jurisdictional requirements. Where registrants seek to skirt those rules, the CFTC will act to ensure compliance and to preserve NFA’s ability to carry out its important oversight function. Our derivatives markets are better served, and the public is better protected, by these important requirements.”
Case Background
The complaints charge that the respondents, though registered as CTAs, are violating CFTC Regulation 170.17, which requires that every registered CTA, unless eligible for certain exemptions, must become and remain a member of at least one RFA.

By failing to maintain membership with the NFA or assert a valid exemption from NFA membership, the respondents have improperly avoided NFA’s industry self-regulation. The NFA is responsible, with CFTC oversight, for certain aspects of the regulation of CTAs and other futures entities, including examining CTAs’ qualifications and proficiency, financial condition, retail sales practices, and business conduct. Because the respondents have not maintained their membership with NFA, it has had no jurisdiction to perform its vital self-regulatory functions with respect to the respondents.

In its enforcement action, the CFTC seeks an order directing the respondents to cease and desist from violating the provision requiring membership in an RFA.

The CFTC thanks NFA for its cooperation and assistance.","The Division of Enforcement staff members responsible for this action are Douglas Snodgrass, Elizabeth N. Pendleton, Scott R.
Williamson, Joan Manley, and Robert T. Howell.

-CFTC-",0
