folder,press_release_text,dd_id,dd_date,dd_h1,dd_article,dd_end,dd_error
7265-15,"Release Number 7265-15

 

October 20, 2015

CFTC Orders BNP Paribas Securities Corp. to Pay a $140,000 Penalty to Settle Charges of
Improper Investment of Customer Segregated Funds

Washington, DC - The U.S. Commodity Futures Trading Commission (CFTC) today issued an Order instituting and
simultaneously settling charges against BNP Paribas Securities Corp. (BNPP), a registered Futures Commission
Merchant (FCM) based in New York, New York, for violating the CFTC’s Regulations governing concentration limits
applicable to the investment of segregated commodity customer funds. The CFTC Order requires BNPP to pay a $140,000
civil monetary penalty and to cease and desist from violating CFTC Regulations, as charged. The Order also requires that
BNPP must regularly review its policies and procedures and provide training to ensure compliance with applicable
regulations.

The Order finds that on three occasions, in or about November and December 2014, BNPP violated the CFTC Regulations
governing concentration limits applicable to the investment of segregated commodity customer funds. BNPP reported
two of the violations to the CFTC and an additional violation was discovered by BNPP’s designated Self-Regulatory
Organization, CME Group Inc. On two of the three days, BNPP invested more than 10 percent of segregated customer
funds in an individual money market mutual fund, in violation of Regulation 1.25(b)(3)(ii)(D), according to the Order.

The Order further finds that on two of the three days, BNPP invested more than 50 percent of segregated customer funds
in money market mutual funds, in violation of Regulation 1.25(b)(3)(i)(F).

The Order states that none of the violations resulted in any customer losses.

In the Order, the CFTC recognizes BNPP’s cooperation during the CFTC’s investigation and that BNPP voluntarily
undertook remedial action to strengthen its policies and procedures related to compliance with the applicable
regulations.

The CFTC appreciates the assistance of the CME Group Inc. in this matter.

The CFTC’s Division of Enforcement thanks Shoshana Feldman and Annette Vitale of the Division of Swap Dealer and
Intermediary Oversight. The CFTC Division of Enforcement staff members responsible for this case are Neel Chopra,
Patryk J. Chudy, Lenel Hickson, Jr. and Manal M. Sultan.

Media Contact
Dennis Holden
202-418-5088

Last Updated: October 20, 2015
",Release Number 7265-15,"October 20, 2015","CFTC Orders BNP Paribas Securities Corp. to Pay a $140,000 Penalty to Settle Charges of Improper Investment of Customer Segregated Funds. Washington, DC - The U.S. Commodity Futures Trading Commission (CFTC) today issued an Order instituting and simultaneously settling charges against BNP Paribas Securities Corp. (BNPP), a registered Futures Commission Merchant (FCM) based in New York, New York, for violating the CFTC’s Regulations governing concentration limits applicable to the investment of segregated commodity customer funds. The CFTC Order requires BNPP to pay a $140,000 civil monetary penalty and to cease and desist from violating CFTC Regulations, as charged. The Order also requires that BNPP must regularly review its policies and procedures and provide training to ensure compliance with applicable regulations.. The Order finds that on three occasions, in or about November and December 2014, BNPP violated the CFTC Regulations governing concentration limits applicable to the investment of segregated commodity customer funds. BNPP reported two of the violations to the CFTC and an additional violation was discovered by BNPP’s designated Self-Regulatory Organization, CME Group Inc. On two of the three days, BNPP invested more than 10 percent of segregated customer funds in an individual money market mutual fund, in violation of Regulation 1.25(b)(3)(ii)(D), according to the Order.. The Order further finds that on two of the three days, BNPP invested more than 50 percent of segregated customer funds in money market mutual funds, in violation of Regulation 1.25(b)(3)(i)(F).. The Order states that none of the violations resulted in any customer losses.. In the Order, the CFTC recognizes BNPP’s cooperation during the CFTC’s investigation and that BNPP voluntarily undertook remedial action to strengthen its policies and procedures related to compliance with the applicable regulations.. The CFTC appreciates the assistance of the CME Group Inc. in this matter.. The CFTC’s Division of Enforcement thanks Shoshana Feldman and Annette Vitale of the Division of Swap Dealer and Intermediary Oversight. The CFTC Division of Enforcement staff members responsible for this case are Neel Chopra, Patryk J. Chudy, Lenel Hickson, Jr. and Manal M. Sultan.. Media Contact Dennis Holden 202-418-5088. Last Updated: October 20, 201.","Release Number 7265-15

October 20, 2015
CFTC Orders BNP Paribas Securities Corp. to Pay a $140,000 Penalty to Settle Charges of Improper Investment of Customer Segregated Funds
Washington, DC - The U.S. Commodity Futures Trading Commission (CFTC) today issued an Order instituting and simultaneously settling charges against BNP Paribas Securities Corp. (BNPP), a registered Futures Commission Merchant (FCM) based in New York, New York, for violating the CFTC’s Regulations governing concentration limits applicable to the investment of segregated commodity customer funds. The CFTC Order requires BNPP to pay a $140,000 civil monetary penalty and to cease and desist from violating CFTC Regulations, as charged. The Order also requires that BNPP must regularly review its policies and procedures and provide training to ensure compliance with applicable regulations.

The Order finds that on three occasions, in or about November and December 2014, BNPP violated the CFTC Regulations governing concentration limits applicable to the investment of segregated commodity customer funds. BNPP reported two of the violations to the CFTC and an additional violation was discovered by BNPP’s designated Self-Regulatory Organization, CME Group Inc. On two of the three days, BNPP invested more than 10 percent of segregated customer funds in an individual money market mutual fund, in violation of Regulation 1.25(b)(3)(ii)(D), according to the Order.

The Order further finds that on two of the three days, BNPP invested more than 50 percent of segregated customer funds in money market mutual funds, in violation of Regulation 1.25(b)(3)(i)(F).

The Order states that none of the violations resulted in any customer losses.

In the Order, the CFTC recognizes BNPP’s cooperation during the CFTC’s investigation and that BNPP voluntarily undertook remedial action to strengthen its policies and procedures related to compliance with the applicable regulations.

The CFTC appreciates the assistance of the CME Group Inc. in this matter.","The CFTC’s Division of Enforcement thanks Shoshana Feldman and Annette Vitale of the Division of Swap Dealer and Intermediary Oversight. The CFTC Division of Enforcement staff members responsible for this case are Neel Chopra, Patryk J. Chudy, Lenel Hickson, Jr. and Manal M. Sultan.

Media Contact Dennis Holden 202-418-5088
Last Updated: October 20, 2015",0
7778-18,"Release Number 7778-18
August 29, 2018

CFTC Charges Forex Trader and Firm with Fraud and Registration Violations

Washington, DC—The Commodity Futures Trading Commission (CFTC) today filed a federal court enforcement action in
the U.S. District Court for the Southern District of New York against Jason Amada of New York, New York, and Amada
Capital Management LLC (ACM), a New York entity owned and controlled by Amada. The CFTC Complaint charges
that, from at least February 2014 through at least November 2015, the Defendants fraudulently solicited potential clients
to open individually managed trading accounts for off-exchange foreign currency contracts (forex) and hid substantial
trading losses incurred as a result of Defendants’ managed forex trading.

Specifically, the Complaint alleges that the Defendants fraudulently solicited clients for these accounts by, among other
things, misrepresenting Defendants’ forex trading experience and profitability. In addition, the Complaint alleges that
the Defendants made the false claim that they would implement a hedging strategy that would prevent losses of more
than one percent. As further alleged, Defendants attempted to conceal mounting losses by transferring some of their
commissions into a client’s account. The Complaint also alleges that the Defendants failed to register with the CFTC as
required.

In its continuing litigation, the CFTC seeks civil monetary penalties, permanent registration and trading bans,
disgorgement, and a permanent injunction against further violations of the Commodity Exchange Act and CFTC
Regulations, as charged.

Related Criminal Charges

Today, the New York State Office of the Attorney General announced a criminal indictment charging Amada with Grand
Larceny in the Second Degree and a violation of the Martin Act, a New York State statute that prohibits, among other
things, the fraudulent sale of commodities products.

The CFTC appreciates the cooperation and assistance of the United Kingdom's Financial Conduct Authority and the New
York State Office of the Attorney General.

CFTC Division of Enforcement staff members responsible for this case are Nicholas Sloey, Rachel Hayes, Elsie Robinson,
Peter Riggs, Joyce Brandt, Christopher Reed, and Charles Marvine.

x K K K K K
CFTC’s Foreign Currency (Forex) Fraud Advisory

The CFTC has issued several customer protection Fraud Advisories that provide the warning signs of fraud, including the
Foreign Currency Trading (Forex) Fraud Advisory, which states that the CFTC has witnessed a sharp rise in Forex trading
scams in recent years and helps customers identify this potential fraud.

Also, before investing or trading with a firm, check the firm’s registration status and disciplinary history, if registered,
with the National Futures Association. A company’s registration status can be found at: www.nfa.futures.org/basicnet.

Customers can report suspicious activities or information, such as possible violations of commodity trading laws, to the
CFTC Division of Enforcement via a Toll-Free Hotline 866-FON-CFTC (866-366-2382) or file a tip or complaint online.
","Release Number 7778-18 August 29, 2018",today,"CFTC Charges Forex Trader and Firm with Fraud and Registration Violations. Specifically, the Complaint alleges that the Defendants fraudulently solicited clients for these accounts by, among other things, misrepresenting Defendants’ forex trading experience and profitability. In addition, the Complaint alleges that the Defendants made the false claim that they would implement a hedging strategy that would prevent losses of more than one percent. As further alleged, Defendants attempted to conceal mounting losses by transferring some of their commissions into a client’s account. The Complaint also alleges that the Defendants failed to register with the CFTC as required.. In its continuing litigation, the CFTC seeks civil monetary penalties, permanent registration and trading bans, disgorgement, and a permanent injunction against further violations of the Commodity Exchange Act and CFTC Regulations, as charged.. Related Criminal Charges. Today, the New York State Office of the Attorney General announced a criminal indictment charging Amada with Grand Larceny in the Second Degree and a violation of the Martin Act, a New York State statute that prohibits, among other things, the fraudulent sale of commodities products.. The CFTC appreciates the cooperation and assistance of the United Kingdom's Financial Conduct Authority and the New York State Office of the Attorney General.. CFTC Division of Enforcement staff members responsible for this case are Nicholas Sloey, Rachel Hayes, Elsie Robinson, Peter Riggs, Joyce Brandt, Christopher Reed, and Charles Marvine.. x K K K K K CFTC’s Foreign Currency (Forex) Fraud Advisory. The CFTC has issued several customer protection Fraud Advisories that provide the warning signs of fraud, including the Foreign Currency Trading (Forex) Fraud Advisory, which states that the CFTC has witnessed a sharp rise in Forex trading scams in recent years and helps customers identify this potential fraud.. Also, before investing or trading with a firm, check the firm’s registration status and disciplinary history, if registered, with the National Futures Association. A company’s registration status can be found at: www.nfa.futures.org/basicnet.. Customers can report suspicious activities or information, such as possible violations of commodity trading laws, to the CFTC Division of Enforcement via a Toll-Free Hotline 866-FON-CFTC (866-366-2382) or file a tip or complaint online.","Release Number 7778-18 August 29, 2018
CFTC Charges Forex Trader and Firm with Fraud and Registration Violations
Washington, DC—The Commodity Futures Trading Commission (CFTC) today filed a federal court enforcement action in the U.S. District Court for the Southern District of New York against Jason Amada of New York, New York, and Amada Capital Management LLC (ACM), a New York entity owned and controlled by Amada. The CFTC Complaint charges that, from at least February 2014 through at least November 2015, the Defendants fraudulently solicited potential clients to open individually managed trading accounts for off-exchange foreign currency contracts (forex) and hid substantial trading losses incurred as a result of Defendants’ managed forex trading.

Specifically, the Complaint alleges that the Defendants fraudulently solicited clients for these accounts by, among other things, misrepresenting Defendants’ forex trading experience and profitability. In addition, the Complaint alleges that the Defendants made the false claim that they would implement a hedging strategy that would prevent losses of more than one percent. As further alleged, Defendants attempted to conceal mounting losses by transferring some of their commissions into a client’s account. The Complaint also alleges that the Defendants failed to register with the CFTC as required.

In its continuing litigation, the CFTC seeks civil monetary penalties, permanent registration and trading bans, disgorgement, and a permanent injunction against further violations of the Commodity Exchange Act and CFTC Regulations, as charged.

Related Criminal Charges
Today, the New York State Office of the Attorney General announced a criminal indictment charging Amada with Grand Larceny in the Second Degree and a violation of the Martin Act, a New York State statute that prohibits, among other things, the fraudulent sale of commodities products.

The CFTC appreciates the cooperation and assistance of the United Kingdom's Financial Conduct Authority and the New York State Office of the Attorney General.

CFTC Division of Enforcement staff members responsible for this case are Nicholas Sloey, Rachel Hayes, Elsie Robinson, Peter Riggs, Joyce Brandt, Christopher Reed, and Charles Marvine.

x K K K K K CFTC’s Foreign Currency (Forex) Fraud Advisory
The CFTC has issued several customer protection Fraud Advisories that provide the warning signs of fraud, including the Foreign Currency Trading (Forex) Fraud Advisory, which states that the CFTC has witnessed a sharp rise in Forex trading scams in recent years and helps customers identify this potential fraud.","Also, before investing or trading with a firm, check the firm’s registration status and disciplinary history, if registered, with the National Futures Association. A company’s registration status can be found at: www.nfa.futures.org/basicnet.

Customers can report suspicious activities or information, such as possible violations of commodity trading laws, to the CFTC Division of Enforcement via a Toll-Free Hotline 866-FON-CFTC (866-366-2382) or file a tip or complaint online.",0
8282-20,"Release Number 8282-20

CFTC Revokes Registrations of Florida Company and its CEO for Fraud and Related
Criminal Conviction

October 09, 2020

Washington, D.C. — The Commodity Futures Trading Commission today announced it has revoked the Commodity Pool
Operator and Commodity Trading Advisor registrations of Phy Capital Investments LLC of Miami, Florida and the
Associated Person registration of its owner Fabio Bretas de Freitas, formerly of Miami, Florida.

The CFTC initiated revocation proceedings against Phy Capital and Bretas on May 7, 2020. [See CFTC Press Release No.
8163-20] CFTC Judgment Officer Kavita Kumar Puri issued an Initial Decision on Default on August 31, 2020, which was
finalized on September 30, 2020. Puri found that Phy Capital and Bretas are subject to statutory disqualification from
CFTC registration based on an order entered by the U.S. District Court for the Southern District of New York that, among
other things, (1) found that Phy Capital and Bretas misappropriated commodity pool funds and issued false quarterly
statements to pool participants, (2) permanently enjoined Phy Capital and Bretas from further violations of the anti-fraud
provisions of the Commodity Exchange Act, as charged, and (3) ordered Phy Capital and Bretas jointly and severally to
pay more than $17.2 million in monetary relief. [See CFTC Press Release No. 8052-19]

Puri also found that Bretas is subject to disqualification from CFTC registration based on his conviction for conspiracy to
commit commodities fraud and wire fraud in connection with the same activities, as entered by the U.S. District Court for
the Southern District of New York on February 28, 2020. [See Case No. $3 19 Cr. 257 (LTS)]

The Division of Enforcement staff members responsible for this action are Elizabeth M. Streit, Joy McCormack, Matthew
Edelstein, Stacie Pan, Scott Williamson, and Robert Howell.

-CFTC-
",Release Number 8282-20,"October 09, 2020","CFTC Revokes Registrations of Florida Company and its CEO for Fraud and Related Criminal Conviction. Washington, D.C. — The Commodity Futures Trading Commission today announced it has revoked the Commodity Pool Operator and Commodity Trading Advisor registrations of Phy Capital Investments LLC of Miami, Florida and the Associated Person registration of its owner Fabio Bretas de Freitas, formerly of Miami, Florida.. The CFTC initiated revocation proceedings against Phy Capital and Bretas on May 7, 2020. [See CFTC Press Release No.. 8163-20] CFTC Judgment Officer Kavita Kumar Puri issued an Initial Decision on Default on August 31, 2020, which was finalized on September 30, 2020. Puri found that Phy Capital and Bretas are subject to statutory disqualification from CFTC registration based on an order entered by the U.S. District Court for the Southern District of New York that, among other things, (1) found that Phy Capital and Bretas misappropriated commodity pool funds and issued false quarterly statements to pool participants, (2) permanently enjoined Phy Capital and Bretas from further violations of the anti-fraud provisions of the Commodity Exchange Act, as charged, and (3) ordered Phy Capital and Bretas jointly and severally to pay more than $17.2 million in monetary relief. [See CFTC Press Release No. 8052-19]. Puri also found that Bretas is subject to disqualification from CFTC registration based on his conviction for conspiracy to commit commodities fraud and wire fraud in connection with the same activities, as entered by the U.S. District Court for the Southern District of New York on February 28, 2020. [See Case No. $3 19 Cr. 257 (LTS)]. The Division of Enforcement staff members responsible for this action are Elizabeth M. Streit, Joy McCormack, Matthew Edelstein, Stacie Pan, Scott Williamson, and Robert Howell.","Release Number 8282-20
CFTC Revokes Registrations of Florida Company and its CEO for Fraud and Related Criminal Conviction
October 09, 2020
Washington, D.C. — The Commodity Futures Trading Commission today announced it has revoked the Commodity Pool Operator and Commodity Trading Advisor registrations of Phy Capital Investments LLC of Miami, Florida and the Associated Person registration of its owner Fabio Bretas de Freitas, formerly of Miami, Florida.","The CFTC initiated revocation proceedings against Phy Capital and Bretas on May 7, 2020. [See CFTC Press Release No.
8163-20] CFTC Judgment Officer Kavita Kumar Puri issued an Initial Decision on Default on August 31, 2020, which was finalized on September 30, 2020. Puri found that Phy Capital and Bretas are subject to statutory disqualification from CFTC registration based on an order entered by the U.S. District Court for the Southern District of New York that, among other things, (1) found that Phy Capital and Bretas misappropriated commodity pool funds and issued false quarterly statements to pool participants, (2) permanently enjoined Phy Capital and Bretas from further violations of the anti-fraud provisions of the Commodity Exchange Act, as charged, and (3) ordered Phy Capital and Bretas jointly and severally to pay more than $17.2 million in monetary relief. [See CFTC Press Release No. 8052-19]
Puri also found that Bretas is subject to disqualification from CFTC registration based on his conviction for conspiracy to commit commodities fraud and wire fraud in connection with the same activities, as entered by the U.S. District Court for the Southern District of New York on February 28, 2020. [See Case No. $3 19 Cr. 257 (LTS)]
The Division of Enforcement staff members responsible for this action are Elizabeth M. Streit, Joy McCormack, Matthew Edelstein, Stacie Pan, Scott Williamson, and Robert Howell.

-CFTC-",0
